,Unnamed: 0,_id,url,title,address,time_start,time_end,price_start,price_end,image,score_space,score_quality,score_price,score_service,score_location,total_score_comment_for_excellent,total_score_comment_for_good,total_score_comment_for_avg,total_score_comment_for_bad,avg_score_comment,title_first_chars
1333,1333,6469fb83b1064f9440f70629,https://www.foody.vn/ha-noi/king-roti-giai-phong/binh-luan,"King Roti - Giải Phóng ở Quận Thanh Xuân, Hà Nội | Bình Luận, Review, Nhận xét, Kinh nghiệm |King Roti - Giải Phóng | Foody.vn","447 Giải Phóng, P. Phương Liệt Quận Thanh Xuân Hà Nội",06:30,22:00,15.000đ ,30.000,['https://images.foody.vn/res/g107/1061578/prof/s576x330/foody-upload-api-foody-mobile-avatar-1-201225111058.jpg'],[],[],[],[],[],0,0,0,0,0.0,King Roti - Giải Phó
1346,1346,6469fb83b1064f9440f70636,https://www.foody.vn/ha-noi/alafolie-pastry-bakery-ngoc-thuy/binh-luan-8045274,"Alafolie - Pastry & Bakery - Ngọc Thuỵ ở Quận Long Biên, Hà Nội | Bình luận - À La Folie Pastry & Bakery | Yến Nhi Vương | Foody.vn","Số 42, Ngõ 606 Ngọc Thuỵ, P. Ngọc Thuỵ Quận Long Biên Hà Nội",06:00,21:30,20.000đ ,400.000,['https://images.foody.vn/res/g9/89328/prof/s576x330/file_restaurant_photo_xcjt_16208-5df785b2-210512143103.jpg'],['6.7'],['7.8'],['8.4'],['7.2'],['9.4'],3,12,3,0,7.9,Alafolie - Pastry & 
1357,1357,6469fb83b1064f9440f70641,https://www.foody.vn/ha-noi/hoan-boulangerie-bakery/binh-luan-13652115,"Hoan Boulangerie Bakery ở Quận Hai Bà Trưng, Hà Nội | Bình luận - Dịch vụ | Tâm | Foody.vn",49 Trần Xuân Soạn Quận Hai Bà Trưng Hà Nội,08:00,22:30,15.000đ ,220.000,['https://images.foody.vn/res/g2/11229/prof/s576x330/foody-mobile-960x600_hoan-boulang-975-636143877611900319.jpg'],['6.4'],['7.2'],['7.5'],['6.9'],['7.6'],2,19,4,2,7.1,Hoan Boulangerie Bak
1358,1358,6469fb83b1064f9440f70642,https://www.foody.vn/ha-noi/lau-hap-fresh/binh-luan-8034574,"Lẩu Hấp Fresh ở Quận Bắc Từ Liêm, Hà Nội | Bình luận - Lẩu hấp Fresh - Vinhomes Gardenia | Yến Nhi Vương | Foody.vn","SN B2 -05A Vinhome Gardenia, Hàm Nghi Quận Bắc Từ Liêm Hà Nội",09:00,22:00,30.000đ ,300.000,['https://images.foody.vn/res/g79/780034/prof/s576x330/foody-upload-api-foody-mobile-anh-dai-dien-jpg-180920115118.jpg'],['7.5'],['7.8'],['8.0'],['7.5'],['8.0'],0,3,1,0,7.8,Lẩu Hấp Fresh ở Quận
1359,1359,6469fb83b1064f9440f70643,https://www.foody.vn/ha-noi/o-douceurs-french-pastry-bakery-to-ngoc-van/binh-luan-11299400,"O'Douceurs - French Pastry & Bakery - Tô Ngọc Vân ở Quận Tây Hồ, Hà Nội | Bình luận - O'Douceurs - French Pastry & Bakery | Yến Nhi Vương | Foody.vn","90 Tô Ngọc Vân, P. Quảng An Quận Tây Hồ Hà Nội",07:15,20:00,50.000đ ,300.000,['https://images.foody.vn/res/g24/231550/prof/s576x330/foody-upload-api-foody-mobile-30-1-200504100352.jpg'],['6.9'],['7.3'],['7.4'],['7.0'],['7.7'],0,8,0,1,7.3,O'Douceurs - French 
1363,1363,6469fb83b1064f9440f70647,https://www.foody.vn/ha-noi/saint-honore-am-thuc-phap-trang-tien/binh-luan-17226372,"Saint Honoré - Ẩm Thực Pháp - Tràng Tiền ở Quận Hoàn Kiếm, Hà Nội | Bình luận - Mốt ăn | sùng mí ná | Foody.vn","24 Tràng Tiền, P. Tràng Tiền Quận Hoàn Kiếm Hà Nội",08:00,22:30,65.000đ ,125.000,['https://images.foody.vn/res/g26/253684/prof/s576x330/foody-mobile-10341872_23154191038-675-636035016098156021.jpg'],['6.9'],['7.6'],['7.9'],['7.1'],['8.3'],1,8,1,0,7.5,Saint Honoré - Ẩm Th
1364,1364,6469fb83b1064f9440f70648,https://www.foody.vn/ha-noi/circle-k-vu-pham-ham,"Circle K - Vũ Phạm Hàm ở Quận Cầu Giấy, Hà Nội | Foody.vn",1 Vũ Phạm Hàm Quận Cầu Giấy Hà Nội,00:15,23:59,10.000đ ,200.000,['https://images.foody.vn/res/g69/680407/prof/s576x330/foody-upload-api-foody-mobile-untitled-2-191101141837.jpg'],['4.0'],['4.5'],['4.5'],['4.5'],['4.5'],0,1,0,1,4.4,Circle K - Vũ Phạm H
1365,1365,6469fb83b1064f9440f70649,https://www.foody.vn/ha-noi/hai-san-bien-giau,"Hải Sản Biển Giàu ở Quận Ba Đình, Hà Nội | Foody.vn","108 Phúc Xá, P. Phúc Xá Quận Ba Đình Hà Nội",00:01,23:59,45.000đ ,450.000,['https://images.foody.vn/res/g86/851470/prof/s576x330/foody-upload-api-foody-mobile-untitled-2-191028160913.jpg'],['8.0'],['9.0'],['9.0'],['8.0'],['10.0'],0,1,0,0,8.8,Hải Sản Biển Giàu ở 
1366,1366,6469fb83b1064f9440f7064a,https://www.foody.vn/ha-noi/nhi-food-tra-sua-nem-chua-ran-quan-hoa,"Nhi Food - Trà Sữa & Nem Chua Rán - Quan Hoa ở Quận Cầu Giấy, Hà Nội | Foody.vn","6 Ngõ 97 Quan Hoa, P. Quan Hoa Quận Cầu Giấy Hà Nội",07:30,23:59,20.000đ ,100.000,['https://images.foody.vn/res/g111/1101545/prof/s576x330/file_restaurant_photo_kmds_16314-17d55aec-210912171145.jpg'],['9.4'],['10.0'],['10.0'],['9.8'],['10.0'],60,0,0,0,9.8,Nhi Food - Trà Sữa &
1367,1367,6469fb83b1064f9440f7064b,https://www.foody.vn/ha-noi/hoa-qua-sach-do-an-vat-dong-lanh-quan-hoa,"Hoa Quả Sạch - Đồ Ăn Vặt Đông Lạnh - Quan Hoa ở Quận Cầu Giấy, Hà Nội | Foody.vn","4 Ngõ 97 Quan Hoa, P. Quan Hoa Quận Cầu Giấy Hà Nội",07:30,23:59,30.000đ ,75.000,['https://images.foody.vn/res/g110/1090042/prof/s576x330/file_restaurant_photo_bdw8_16305-1e46c186-210902140540.jpg'],['9.3'],['9.9'],['10.0'],['9.6'],['10.0'],40,0,0,0,9.8,Hoa Quả Sạch - Đồ Ăn
1388,1388,6469fb83b1064f9440f70660,https://www.foody.vn/ha-noi/lotteria-kham-thien/binh-luan-17304666,"Lotteria - Khâm Thiên ở Quận Đống Đa, Hà Nội | Bình luận - Lotteria - Khâm Thiên | Huong Le | Foody.vn",201 - 203 Khâm Thiên Quận Đống Đa Hà Nội,07:30,22:30,30.000đ ,200.000,['https://images.foody.vn/res/g9/80568/prof/s576x330/image-59312363-210614103001.jpeg'],['6.0'],['6.6'],['6.8'],['6.2'],['7.1'],2,36,15,9,6.6,Lotteria - Khâm Thiê
1389,1389,6469fb83b1064f9440f70661,https://www.foody.vn/ha-noi/ba-thu-xoi-gia-truyen/binh-luan-9959553,"Bà Thu - Xôi Gia Truyền ở Quận Hoàn Kiếm, Hà Nội | Bình luận - Ngon và siêu no | tep_2002 | Foody.vn"," 57 Thợ Nhuộm, P. Cửa Nam Quận Hoàn Kiếm Hà Nội",06:00,10:00,10.000đ ,25.000,['https://images.foody.vn/res/g30/296469/prof/s576x330/foody-mobile-xoi-jpg-426-636171598823277901.jpg'],['6.4'],['6.9'],['7.2'],['6.9'],['7.8'],4,7,4,2,7.0,Bà Thu - Xôi Gia Tru
1390,1390,6469fb83b1064f9440f70662,https://www.foody.vn/ha-noi/choice-coffee/binh-luan-11211996,"Choice Coffee ở Quận Hai Bà Trưng, Hà Nội | Bình luận - Choice Coffee | Yến Nhi Vương | Foody.vn","1A Vân Hồ 2, P. Lê Đại Hành Quận Hai Bà Trưng Hà Nội",08:00,22:00,20.000đ ,120.000,['https://images.foody.vn/res/g107/1060366/prof/s576x330/foody-upload-api-foody-mobile-59-201216153119.jpg'],['7.0'],['8.0'],['8.0'],['7.0'],['8.0'],0,1,0,0,7.6,Choice Coffee ở Quận
1391,1391,6469fb83b1064f9440f70663,https://www.foody.vn/ha-noi/tra-sua-leetee-xa-dan-2/binh-luan-17391673,"Trà Sữa LeeTee - Xã Đàn 2 ở Quận Đống Đa, Hà Nội | Bình luận - Trà Sữa LeeTee - Xã Đàn 2 | Huong Le | Foody.vn","63 Ngõ Xã Đàn 2, P. Nam Đồng Quận Đống Đa Hà Nội",08:00,23:00,20.000đ ,55.000,['https://images.foody.vn/res/g68/678209/prof/s576x330/foody-upload-api-foody-mobile-lee-tee-190108114007.jpg'],['6.9'],['7.4'],['7.6'],['7.3'],['7.7'],25,99,23,15,7.4,Trà Sữa LeeTee - Xã 
1395,1395,6469fb83b1064f9440f70667,https://www.foody.vn/ha-noi/xoi-may-ly-thuong-kiet/binh-luan-2976065,"Xôi Mây - Lý Thường Kiệt ở Quận Hoàn Kiếm, Hà Nội | Bình luận - Ổn | tabi mon | Foody.vn","31 Lý Thường Kiệt, P. Hàng Bài Quận Hoàn Kiếm Hà Nội",06:00,09:00,10.000đ ,15.000,['https://images.foody.vn/res/g24/235865/prof/s576x330/foody-mobile-22-jpg-596-635991597822534745.jpg'],['7.3'],['8.4'],['8.4'],['8.1'],['9.0'],5,21,0,0,8.3,Xôi Mây - Lý Thường 
1432,1432,6469fb83b1064f9440f7068c,https://www.foody.vn/ha-noi/vita-juice-bar-van-ho-2/binh-luan-11234041,"Vita Juice Bar - Vân Hồ 2 ở Quận Hai Bà Trưng, Hà Nội | Bình luận - Caffè Della Vita | Yến Nhi Vương | Foody.vn","15 Vân Hồ 2, P. Lê Đại Hành Quận Hai Bà Trưng Hà Nội",09:00,22:00,15.000đ ,50.000,['https://images.foody.vn/res/g81/803978/prof/s576x330/foody-upload-api-foody-mobile-vita-jpg-181130142650.jpg'],['6.5'],['7.0'],['7.5'],['7.0'],['8.0'],0,1,1,0,7.2,Vita Juice Bar - Vân
1437,1437,6469fb83b1064f9440f70691,https://www.foody.vn/ha-noi/the-cuppa-coffee/binh-luan-13634998,"The Cuppa Coffee ở Quận Đống Đa, Hà Nội | Bình luận - The Cuppa Coffee | Minh Đức | Foody.vn","66A Hoàng Cầu, P. Trung Liệt Quận Đống Đa Hà Nội",07:00,23:00,30.000đ ,60.000,['https://images.foody.vn/res/g103/1024927/prof/s576x330/foody-upload-api-foody-mobile-97365308_53843462018-200522143702.jpg'],['4.0'],['4.8'],['6.0'],['4.2'],['6.8'],0,1,2,2,5.2,The Cuppa Coffee ở Q
1463,1463,6469fb83b1064f9440f706ab,https://www.foody.vn/ha-noi/isalad-tong-duy-tan,"ISalad+ - Nguyễn Chí Thanh ở Quận Ba Đình, Hà Nội | Foody.vn",Ngõ 29 Nguyễn Chí Thanh (Vào Ngõ Rẽ Phải Nhà Thứ 5) Quận Ba Đình Hà Nội,07:30,22:00,25.000đ ,150.000,['https://images.foody.vn/res/g17/160117/prof/s576x330/foody-mobile-il-jpg-557-636426410437534393.jpg'],['6.2'],['7.0'],['7.0'],['6.8'],['7.2'],4,35,13,7,6.8,ISalad+ - Nguyễn Chí
1464,1464,6469fb83b1064f9440f706ac,https://www.foody.vn/ha-noi/healthwich-vietnam-do-an-nhanh,"Healthwich Vietnam - Submarine Sandwich & Salad - Tô Ngọc Vân ở Quận Tây Hồ, Hà Nội | Foody.vn","26 Tô Ngọc Vân, P. Quảng An Quận Tây Hồ Hà Nội",06:30,23:00,10.000đ ,80.000,['https://images.foody.vn/res/g8/73508/prof/s576x330/foody-mobile-img_4865-jpg.jpg'],['7.0'],['7.6'],['8.0'],['7.4'],['8.1'],5,63,6,3,7.6,Healthwich Vietnam -
1467,1467,6469fb83b1064f9440f706af,https://www.foody.vn/ha-noi/le-s-nail-nguyen-ngoc-nai,"Le's Nail - Nguyễn Ngọc Nại ở Quận Thanh Xuân, Hà Nội | Foody.vn",238 Nguyễn Ngọc Nại Quận Thanh Xuân Hà Nội,08:00,21:00,100.000đ ,500.000,['https://images.foody.vn/res/g18/176613/prof/s576x330/foody-mobile-nailsxinh-jpg-822-635805247359700431.jpg'],['9.0'],['9.0'],['9.0'],['9.0'],['10.0'],1,0,0,0,9.2,Le's Nail - Nguyễn N
1468,1468,6469fb83b1064f9440f706b0,https://www.foody.vn/ha-noi/nail-cafe-xa-dan-2,"Nail Cafe - Xã Đàn 2 ở Quận Đống Đa, Hà Nội | Foody.vn",160 Xã Đàn 2 Quận Đống Đa Hà Nội,07:00,22:30,20.000đ ,50.000,['https://images.foody.vn/res/g14/132363/prof/s576x330/foody-mobile-nail-cf1-jpg-830-635653955060770703.jpg'],['7.0'],['8.0'],['8.0'],['7.0'],['8.3'],0,2,1,0,7.7,Nail Cafe - Xã Đàn 2
1473,1473,6469fb83b1064f9440f706b5,https://www.foody.vn/ha-noi/gusto-coffee-tree-hoang-cau/binh-luan-12988954,"Gusto Coffee Tree - Hoàng Cầu ở Quận Đống Đa, Hà Nội | Bình luận - Gusto Coffee Tree - Hoàng Cầu | Quỳnhchi Nguyễn | Foody.vn","18 ngõ 34 Hoàng Cầu, Ô Chợ Dừa Quận Đống Đa Hà Nội",07:00,22:00,35.000đ ,45.000,['https://images.foody.vn/res/g107/1065374/prof/s576x330/foody-upload-api-foody-mobile-cover-210130122939.jpg'],['7.5'],['8.0'],['8.5'],['8.0'],['8.5'],0,2,0,0,8.1,Gusto Coffee Tree - 
1474,1474,6469fb83b1064f9440f706b6,https://www.foody.vn/ha-noi/olive-coffee-cake/binh-luan-10931663,"Olive Coffee & Cake ở Quận Đống Đa, Hà Nội | Bình luận - Olive Coffee & Cake | Yến Nhi Vương | Foody.vn",72 Ngõ 9 Hoàng Cầu Quận Đống Đa Hà Nội,09:00,23:00,29.000đ ,52.000,['https://images.foody.vn/res/g103/1025492/prof/s576x330/foody-upload-api-foody-mobile-100088645_1418740674-200525163258.jpg'],['7.8'],['8.3'],['8.3'],['8.0'],['8.5'],0,4,0,0,8.2,Olive Coffee & Cake 
1477,1477,6469fb83b1064f9440f706b9,https://www.foody.vn/ha-noi/rio-tattoo-thuy-khue/binh-luan-2399359,"Rio Tattoo - Thụy Khuê ở Quận Tây Hồ, Hà Nội | Bình luận - Hình xăm mini | Linh Lý | Foody.vn",217 Thụy Khuê Quận Tây Hồ Hà Nội,08:00,22:00,100.000đ ,1.000.000,['https://images.foody.vn/res/g22/215152/prof/s576x330/foody-mobile-719-jpg-222-635931197041429352.jpg'],['8.0'],['9.0'],['9.0'],['9.0'],['9.0'],0,1,0,0,8.8,Rio Tattoo - Thụy Kh
1480,1480,6469fb83b1064f9440f706bc,https://www.foody.vn/ha-noi/trang-sai-gon-to-hien-thanh,"Trang Sài Gòn - Tô Hiến Thành ở Quận Hai Bà Trưng, Hà Nội | Foody.vn",84B Tô Hiến Thành Quận Hai Bà Trưng Hà Nội,08:30,19:00,50.000đ ,2.000.000,['https://images.foody.vn/res/g11/102287/prof/s576x330/foody-mobile-toc2-jpg-681-635521800098302139.jpg'],['6.0'],['7.0'],['8.0'],['6.0'],['8.0'],0,1,0,0,7.0,Trang Sài Gòn - Tô H
1485,1485,6469fb83b1064f9440f706c1,https://www.foody.vn/ha-noi/happy-brew-coffee/binh-luan-10574145,"Happy Brew Coffee ở Quận Ba Đình, Hà Nội | Bình luận - Happy Brew Coffee | Yến Nhi Vương | Foody.vn","43 Linh Lang, P. Cống Vị Quận Ba Đình Hà Nội",08:00,18:00,30.000đ ,100.000,['https://images.foody.vn/res/g103/1023435/prof/s576x330/file_restaurant_photo_bw3v_16184-638a9845-210415155129.jpg'],['8.0'],['9.0'],['9.0'],['9.0'],['9.0'],0,1,0,0,8.8,Happy Brew Coffee ở 
1487,1487,6469fb83b1064f9440f706c3,https://www.foody.vn/ha-noi/the-note-coffee-luong-van-can/binh-luan-3848828,"The Note Coffee - Thông Điệp Yêu Thương ở Quận Hoàn Kiếm, Hà Nội | Bình luận - The Note Coffee -*** | Trung Nguyễn | Foody.vn","64 Lương Văn Can, P. Hàng Trống Quận Hoàn Kiếm Hà Nội",06:30,23:00,35.000đ ,132.000,['https://images.foody.vn/res/g3/25028/prof/s576x330/foody-mobile-the-note-jpg-641-635870726792615297.jpg'],['6.5'],['7.7'],['8.1'],['7.3'],['8.1'],11,80,23,3,7.5,The Note Coffee - Th
1489,1489,6469fb83b1064f9440f706c5,https://www.foody.vn/ha-noi/cafe-stattoo,"Cafe Stattoo ở Quận Hai Bà Trưng, Hà Nội | Foody.vn",69B Lạc Trung Quận Hai Bà Trưng Hà Nội,09:00,22:00,20.000đ ,2.000.000,['https://images.foody.vn/res/g21/205248/prof/s576x330/foody-mobile-39-jpg-478-635887343179337212.jpg'],['8.0'],['9.5'],['9.5'],['8.5'],['10.0'],1,1,0,0,9.1,Cafe Stattoo ở Quận 
1490,1490,6469fb83b1064f9440f706c6,https://www.foody.vn/ha-noi/longka-tattoo,"Longka Tattoo ở Quận Long Biên, Hà Nội | Foody.vn",95/81 Vũ Xuân Thiều Quận Long Biên Hà Nội,09:00,22:00,200.000đ ,2.000.000,['https://images.foody.vn/res/g73/721283/prof/s576x330/foody-upload-api-foody-mobile-28276809_95702254111-180305173306.jpg'],['9.3'],['10.0'],['10.0'],['10.0'],['10.0'],3,0,0,0,9.9,Longka Tattoo ở Quận
1491,1491,6469fb83b1064f9440f706c7,https://www.foody.vn/ha-noi/sinh-anh-hairstylist-de-la-thanh,"Sinh Anh Hairstylist - Đê La Thành ở Quận Đống Đa, Hà Nội | Foody.vn",466 Đê La Thành Quận Đống Đa Hà Nội,08:30,18:30,120.000đ ,500.000,['https://images.foody.vn/res/g11/101231/prof/s576x330/foody-mobile-sinh-anh-jpg-497-635515694443631843.jpg'],['6.8'],['7.2'],['7.2'],['7.2'],['7.8'],1,3,0,1,7.2,Sinh Anh Hairstylist
1493,1493,6469fb83b1064f9440f706c9,https://www.foody.vn/ha-noi/hollywood-salon-truong-dinh,"Hollywood Salon - Trương Định ở Quận Hai Bà Trưng, Hà Nội | Foody.vn",348 Trương Định Quận Hai Bà Trưng Hà Nội,08:00,20:00,100.000đ ,3.000.000,['https://images.foody.vn/res/g11/103101/prof/s576x330/foody-mobile-hs2-jpg-681-635526202245386102.jpg'],['6.0'],['8.0'],['8.0'],['7.0'],['9.0'],0,1,0,0,7.6,Hollywood Salon - Tr
1496,1496,6469fb83b1064f9440f706cc,https://www.foody.vn/ha-noi/salon-toc-dai-dong-nguyen-hong,"Salon Tóc Đại Đồng - Nguyên Hồng ở Quận Ba Đình, Hà Nội | Foody.vn",8 Ngõ 28 Nguyên Hồng Quận Ba Đình Hà Nội,08:00,22:00,50.000đ ,500.000,['https://images.foody.vn/res/g11/100623/prof/s576x330/foody-mobile-salon1-jpg-992-635512365452497166.jpg'],['6.0'],['7.0'],['8.0'],['7.0'],['8.0'],0,1,0,0,7.2,Salon Tóc Đại Đồng -
1497,1497,6469fb83b1064f9440f706cd,https://www.foody.vn/ha-noi/huong-phi-hair-salon-de-la-thanh,"Hương Phi Hair Salon - Đê La Thành ở Quận Ba Đình, Hà Nội | Foody.vn","953 Đê La Thành, P. Ngọc Khánh Quận Ba Đình Hà Nội",08:30,22:00,50.000đ ,2.000.000,['https://images.foody.vn/res/g15/143288/prof/s576x330/sheis-4f471976-d8ec-4567-ac34-d8f46a02a5ea-20181030154140097.jpg'],['9.0'],['9.0'],['9.0'],['9.0'],['9.0'],1,0,0,0,9.0,Hương Phi Hair Salon
1501,1501,6469fb83b1064f9440f706d1,https://www.foody.vn/ha-noi/thuy-toc-dep,"Thủy - Tóc Đẹp ở Quận Đống Đa, Hà Nội | Foody.vn","111 A3 Ngõ 4 Phương Mai, P. Phương Mai Quận Đống Đa Hà Nội",09:00,21:00,25.000đ ,400.000,['https://images.foody.vn/res/g23/229426/prof/s576x330/foody-mobile-uon-duoi-jpg-495-635967427859304924.jpg'],['10.0'],['10.0'],['10.0'],['10.0'],['10.0'],1,0,0,0,10.0,Thủy - Tóc Đẹp ở Quậ
1506,1506,6469fb83b1064f9440f706d6,https://www.foody.vn/ha-noi/noi-mi-ha-mun,"Nối Mi Hà Mun ở Quận Ba Đình, Hà Nội | Foody.vn",D2 TT. Thành Công Quận Ba Đình Hà Nội,09:00,20:30,180.000đ ,250.000,['https://images.foody.vn/res/g24/235149/prof/s576x330/foody-mobile-13133103_93171663692-545-635986485982870236.jpg'],['8.0'],['9.0'],['9.0'],['8.0'],['9.0'],0,1,0,0,8.6,Nối Mi Hà Mun ở Quận
1507,1507,6469fb83b1064f9440f706d7,https://www.foody.vn/ha-noi/cao-huynh-hair-salon,"Cao Huỳnh Hair Salon ở Quận Hà Đông, Hà Nội | Foody.vn",174 Nguyễn Viết Xuân Quận Hà Đông Hà Nội,08:00,22:00,30.000đ ,1.000.000,['https://images.foody.vn/res/g65/640037/prof/s576x330/foody-mobile-caohuy-jpg-466-636243983898505717.jpg'],['7.0'],['7.0'],['7.0'],['7.0'],['8.0'],0,1,0,0,7.2,Cao Huỳnh Hair Salon
1508,1508,6469fb83b1064f9440f706d8,https://www.foody.vn/ha-noi/hoc-vien-toc-quoc-te-f5,"Học Viện Tóc Quốc Tế F5 ở Quận Long Biên, Hà Nội | Foody.vn",21 Ngõ 390 Nguyễn Văn Cừ Quận Long Biên Hà Nội,09:00,22:00,100.000đ ,800.000,['https://images.foody.vn/res/g68/673985/prof/s576x330/foody-mobile-539-jpg-577-636356288313947003.jpg'],['8.0'],['10.0'],['10.0'],['8.0'],['10.0'],1,0,0,0,9.2,Học Viện Tóc Quốc Tế
1509,1509,6469fb83b1064f9440f706d9,https://www.foody.vn/ha-noi/tu-linh-hair-salon,"Tú Linh Hair Salon ở Quận Ba Đình, Hà Nội | Foody.vn","18 Yên Phụ, P. Trúc Bạch Quận Ba Đình Hà Nội",08:30,19:30,50.000đ ,1.000.000,['https://images.foody.vn/res/g24/230402/prof/s576x330/foody-mobile-tu-linh1-jpg-789-635969377712548683.jpg'],['8.0'],['8.0'],['8.0'],['8.0'],['9.0'],0,1,0,0,8.2,Tú Linh Hair Salon ở
1510,1510,6469fb83b1064f9440f706da,https://www.foody.vn/ha-noi/hair-hoang-nguyen-phan-phu-tien,"Hair Hoàng Nguyễn - Phan Phù Tiên ở Quận Đống Đa, Hà Nội | Foody.vn",37 Phan Phù Tiên Quận Đống Đa Hà Nội,09:00,21:00,50.000đ ,1.000.000,['https://images.foody.vn/res/g13/123200/prof/s576x330/foody-mobile-21-jpg-270-635609123791370270.jpg'],['6.0'],['8.0'],['8.0'],['7.0'],['9.0'],0,1,0,0,7.6,Hair Hoàng Nguyễn - 
1511,1511,6469fb83b1064f9440f706db,https://www.foody.vn/ha-noi/hair-salon-mai-nhung-nguyen-chinh,"Hair Salon Mai Nhung - Nguyễn Chính ở Quận Hoàng Mai, Hà Nội | Foody.vn","35 Nguyễn Chính, P. Tân Mai Quận Hoàng Mai Hà Nội",08:00,22:00,100.000đ ,500.000,['https://images.foody.vn/res/g13/123062/prof/s576x330/foody-mobile-hair-salon1-jpg-206-635606343824429318.jpg'],['10.0'],['10.0'],['10.0'],['10.0'],['10.0'],1,0,0,0,10.0,Hair Salon Mai Nhung
1512,1512,6469fb83b1064f9440f706dc,https://www.foody.vn/ha-noi/nguyen-giang-xam-nghe-thuat/binh-luan,"Nguyễn Giang - Xăm Nghệ Thuật ở Quận Cầu Giấy, Hà Nội | Bình Luận, Review, Nhận xét, Kinh nghiệm |Nguyễn Giang - Xăm Nghệ Thuật | Foody.vn",299 Tô Hiệu Quận Cầu Giấy Hà Nội,08:00,21:00,100.000đ ,5.000.000,['https://images.foody.vn/res/g73/722650/prof/s576x330/foody-upload-api-foody-mobile-28685428_27522495301-180312114551.jpg'],[],[],[],[],[],0,0,0,0,0.0,Nguyễn Giang - Xăm N
1513,1513,6469fb83b1064f9440f706dd,https://www.foody.vn/ha-noi/thu-bay-hair-salon-doi-can,"Thu Bẩy Hair Salon - Đội Cấn ở Quận Ba Đình, Hà Nội | Foody.vn",257 Đội Cấn Quận Ba Đình Hà Nội,08:30,19:30,100.000đ ,3.000.000,['https://images.foody.vn/res/g11/104306/prof/s576x330/foody-mobile-tb2-jpg-549-635532186515781485.jpg'],['6.0'],['6.5'],['7.5'],['6.5'],['8.0'],0,1,1,0,6.9,Thu Bẩy Hair Salon -
1514,1514,6469fb83b1064f9440f706de,https://www.foody.vn/ha-noi/nam-tora-tatoo/binh-luan,"Nam Tora Tatoo ở Quận Ba Đình, Hà Nội | Bình Luận, Review, Nhận xét, Kinh nghiệm |Nam Tora Tatoo | Foody.vn",111 Đội Cấn Quận Ba Đình Hà Nội,09:00,21:00,25.000đ ,100.000,['https://images.foody.vn/res/g24/230797/prof/s576x330/foody-mobile-13062296_11204326313-206-635971991246795335.jpg'],[],[],[],[],[],0,0,0,0,0.0,Nam Tora Tatoo ở Quậ
1530,1530,6469fb83b1064f9440f706ee,https://www.foody.vn/ha-noi/cuong-xam-ha-noi-studio/binh-luan,"Cường Xăm Hà Nội Studio ở Quận Nam Từ Liêm, Hà Nội | Bình Luận, Review, Nhận xét, Kinh nghiệm |Cường Xăm Hà Nội Studio | Foody.vn","Tổ Dân Phố 4, Làng Miêu Nha, P. Tây Mỗ Quận Nam Từ Liêm Hà Nội",09:00,23:00,150.000đ ,500.000,['https://images.foody.vn/res/g75/748112/prof/s576x330/foody-upload-api-foody-mobile-26993935_15612759606-180607095920.jpg'],[],[],[],[],[],0,0,0,0,0.0,Cường Xăm Hà Nội Stu
1531,1531,6469fb83b1064f9440f706ef,https://www.foody.vn/ha-noi/the-korea-beauty-phun-theu-tham-my/binh-luan,"The Korea Beauty - Phun Thêu Thẩm Mỹ ở Quận Hoàn Kiếm, Hà Nội | Bình Luận, Review, Nhận xét, Kinh nghiệm |The Korea Beauty - Phun Thêu Thẩm Mỹ | Foody",28 Bạch Đằng Quận Hoàn Kiếm Hà Nội,09:00,19:00,100.000đ ,500.000,['https://images.foody.vn/res/g27/267307/prof/s576x330/foody-mobile-6-jpg-642-636075596116364206.jpg'],[],[],[],[],[],0,0,0,0,0.0,The Korea Beauty - P
1532,1532,6469fb83b1064f9440f706f0,https://www.foody.vn/ha-noi/tuan-tattoo-lai-xa/binh-luan,"Tuấn Tattoo - Lai Xá ở Huyện Hoài Đức, Hà Nội | Bình Luận, Review, Nhận xét, Kinh nghiệm | Tuấn Tattoo - Lai Xá | Foody.vn","QL 32, Khu Tái Định Cư Lai Xá, Kim Chung Huyện Hoài Đức Hà Nội",08:00,21:00,200.000đ ,1.000.000,['https://images.foody.vn/res/g20/192113/prof/s576x330/foody-mobile-1664-jpg-496-635847525052730598.jpg'],[],[],[],[],[],0,0,0,0,0.0,Tuấn Tattoo - Lai Xá
1533,1533,6469fb83b1064f9440f706f1,https://www.foody.vn/ha-noi/hoai-spa-phun-xam-tham-my/binh-luan,"Hoài Spa - Phun Xăm Thẩm Mỹ ở Quận Cầu Giấy, Hà Nội | Bình Luận, Review, Nhận xét, Kinh nghiệm |Hoài Spa - Phun Xăm Thẩm Mỹ | Foody.vn",20 Ngõ 171 Nguyễn Ngọc Vũ Quận Cầu Giấy Hà Nội,09:00,21:00,500.000đ ,2.000.000,['https://images.foody.vn/res/g29/282934/prof/s576x330/foody-mobile-phun-xam-jpg-615-636117209573071723.jpg'],[],[],[],[],[],0,0,0,0,0.0,Hoài Spa - Phun Xăm 
1534,1534,6469fb83b1064f9440f706f2,https://www.foody.vn/ha-noi/bubble-tattoo/binh-luan,"Bubble Tattoo ở Quận Hoàn Kiếm, Hà Nội | Bình Luận, Review, Nhận xét, Kinh nghiệm |Bubble Tattoo | Foody.vn",12 Lương Ngọc Quyến Quận Hoàn Kiếm Hà Nội,08:00,21:00,500.000đ ,1.000.000,['https://images.foody.vn/res/g30/299541/prof/s576x330/foody-mobile-638-jpg-643-636195792149441311.jpg'],[],[],[],[],[],0,0,0,0,0.0,Bubble Tattoo ở Quận
1535,1535,6469fb83b1064f9440f706f3,https://www.foody.vn/ha-noi/xam-hinh-nghe-thuat/binh-luan,"Xăm Hình Nghệ Thuật ở Quận Long Biên, Hà Nội | Bình Luận, Review, Nhận xét, Kinh nghiệm |Xăm Hình Nghệ Thuật | Foody.vn",Số 1 Ngõ 199 Long Biên Quận Long Biên Hà Nội,09:00,22:00,100.000đ ,3.000.000,['https://images.foody.vn/res/g24/235439/prof/s576x330/foody-mobile-2-jpg-610-635987304411810809.jpg'],[],[],[],[],[],0,0,0,0,0.0,Xăm Hình Nghệ Thuật 
1536,1536,6469fb83b1064f9440f706f4,https://www.foody.vn/ha-noi/dat-tattoo-xam-nghe-thuat/binh-luan,"Đạt Tattoo - Xăm Nghệ Thuật ở Quận Hai Bà Trưng, Hà Nội | Bình Luận, Review, Nhận xét, Kinh nghiệm |Đạt Tattoo - Xăm Nghệ Thuật | Foody.vn",196 Nguyễn Khoái Quận Hai Bà Trưng Hà Nội,08:00,21:00,300.000đ ,3.000.000,['https://images.foody.vn/res/g24/234969/prof/s576x330/foody-mobile-2-jpg-319-635985702678302709.jpg'],[],[],[],[],[],0,0,0,0,0.0,Đạt Tattoo - Xăm Ngh
1537,1537,6469fb83b1064f9440f706f5,https://www.foody.vn/ha-noi/hanoi-tattoo-club/binh-luan,"Hanoi Tattoo Club ở Quận Hai Bà Trưng, Hà Nội | Bình Luận, Review, Nhận xét, Kinh nghiệm |Hanoi Tattoo Club | Foody.vn",101 Ngõ 100 Trần Đại Nghĩa Quận Hai Bà Trưng Hà Nội,09:00,21:00,100.000đ ,3.000.000,['https://images.foody.vn/res/g24/235273/prof/s576x330/foody-mobile-2-jpg-138-635986649768512640.jpg'],[],[],[],[],[],0,0,0,0,0.0,Hanoi Tattoo Club ở 
1538,1538,6469fb83b1064f9440f706f6,https://www.foody.vn/ha-noi/century-ink-xam-khuyen/binh-luan,"Century Ink - Xăm & Khuyên ở Quận Hoàn Kiếm, Hà Nội | Bình Luận, Review, Nhận xét, Kinh nghiệm |Century Ink - Xăm & Khuyên | Foody.vn",9 Hàng Vải Quận Hoàn Kiếm Hà Nội,11:00,19:30,100.000đ ,2.000.000,['https://images.foody.vn/res/g24/235426/prof/s576x330/foody-mobile-2-jpg-152-635987269873691737.jpg'],[],[],[],[],[],0,0,0,0,0.0,Century Ink - Xăm & 
1547,1547,6469fb83b1064f9440f706ff,https://www.foody.vn/ha-noi/xam-nghe-thuat/binh-luan,"Xăm Nghệ Thuật ở Quận Đống Đa, Hà Nội | Bình Luận, Review, Nhận xét, Kinh nghiệm |Xăm Nghệ Thuật | Foody.vn",34 ngõ 119 Tây Sơn Quận Đống Đa Hà Nội,09:00,22:00,100.000đ ,3.000.000,['https://images.foody.vn/res/g24/235442/prof/s576x330/foody-mobile-2-jpg-350-635987320268166143.jpg'],[],[],[],[],[],0,0,0,0,0.0,Xăm Nghệ Thuật ở Quậ
