,Unnamed: 0,_id,url,title,address,time_start,time_end,price_start,price_end,image,score_space,score_quality,score_price,score_service,score_location,total_score_comment_for_excellent,total_score_comment_for_good,total_score_comment_for_avg,total_score_comment_for_bad,avg_score_comment,title_first_chars
0,0,6469fb83b1064f9440f700f4,https://www.foody.vn/ha-noi/domino-s-pizza-giang-vo,"Domino's Pizza - Giảng Võ ở Quận Ba Đình, Hà Nội | Foody.vn","Tầng 1, Khu Tập Thể C4, Giảng Võ, P. Giảng Võ Quận Ba Đình Hà Nội",10:00,22:00,49.000đ ,199.000,['https://images.foody.vn/res/g9/86458/prof/s576x330/image-080dc6db-221208141900.jpeg'],['6.7'],['7.5'],['7.6'],['7.2'],['7.9'],20,151,48,8,7.4,Domino's Pizza - Giả
1,1,6469fb83b1064f9440f700f5,https://www.foody.vn/ha-noi/cutisun-bo-bit-tet,"Cutisun - Bò Bít Tết ở Quận Tây Hồ, Hà Nội | Foody.vn","3 Ngõ 120 Hoàng Hoa Thám, P. Thụy Khuê Quận Tây Hồ Hà Nội",10:00,21:00,50.000đ ,165.000,['https://images.foody.vn/res/g5/44367/prof/s576x330/foody-mobile-cutisun-jpg-902-635757753846837030.jpg'],['6.8'],['7.3'],['7.5'],['7.1'],['7.7'],7,214,34,17,7.3,Cutisun - Bò Bít Tết
2,2,6469fb83b1064f9440f700f6,https://www.foody.vn/ha-noi/kfc-yen-phu,"Gà Rán KFC - Yên Phụ ở Quận Tây Hồ, Hà Nội | Foody.vn","7A Yên Phụ, P. Yên Phụ Quận Tây Hồ Hà Nội",09:00,22:00,50.000đ ,110.000,['https://images.foody.vn/res/g1/6243/prof/s576x330/image-371bbbd7-220812160708.jpg'],['6.9'],['7.3'],['7.7'],['7.0'],['8.3'],1,18,3,0,7.4,Gà Rán KFC - Yên Phụ
3,3,6469fb83b1064f9440f700f7,https://www.foody.vn/ha-noi/banh-mi-co-long-nguyen-chi-thanh,"Bánh Mì Cô Long - Nguyễn Chí Thanh ở Quận Ba Đình, Hà Nội | Foody.vn",29 Nguyễn Chí Thanh Quận Ba Đình Hà Nội,07:00,22:00,20.000đ ,100.000,['https://images.foody.vn/res/g10/95927/prof/s576x330/foody-mobile-co-long-jpg-945-636263894836766905.jpg'],['7.8'],['8.3'],['9.0'],['8.3'],['9.1'],246,216,32,15,8.5,Bánh Mì Cô Long - Ng
4,4,6469fb83b1064f9440f700f8,https://www.foody.vn/ha-noi/nha-hang-nhat-ban-kirin,"Nhà hàng Nhật Bản Kirin ở Quận Đống Đa, Hà Nội | Foody.vn","51 Nguyên Hồng, P. Láng Hạ Quận Đống Đa Hà Nội",10:00,14:00 | 17:30 ,150.000đ ,330.000,['https://images.foody.vn/res/g2/17410/prof/s576x330/foody-mobile-kirin-jpg-129-636016056541884086.jpg'],['5.9'],['6.6'],['6.8'],['6.3'],['6.9'],1,10,2,3,6.5,Nhà hàng Nhật Bản Ki
6,6,6469fb83b1064f9440f700fa,https://www.foody.vn/ha-noi/tengcho-korean-bbq,"Tengcho - Korean BBQ ở Quận Hoàng Mai, Hà Nội | Foody.vn","Chung cư HH3C Linh Đàm, Linh Đường Quận Hoàng Mai Hà Nội",09:00,22:00,30.000đ ,200.000,['https://images.foody.vn/res/g31/300396/prof/s576x330/foody-mobile-tangcho-jpg-829-636173920265971602.jpg'],['4.2'],['4.6'],['5.4'],['4.6'],['6.0'],0,4,1,6,4.9,Tengcho - Korean BBQ
18,18,6469fb83b1064f9440f70106,https://www.foody.vn/ha-noi/gogi-house-huynh-thuc-khang,"Gogi House - Nướng Hàn Quốc - Huỳnh Thúc Kháng ở Quận Đống Đa, Hà Nội | Foody.vn",45 Huỳnh Thúc Kháng Quận Đống Đa Hà Nội,08:00,22:00,100.000đ ,300.000,['https://images.foody.vn/res/g26/250742/prof/s576x330/foody-mobile-15-jpg-513-636028097471185757.jpg'],['7.9'],['8.1'],['8.2'],['8.1'],['8.3'],53,38,5,11,8.1,Gogi House - Nướng H
19,19,6469fb83b1064f9440f70107,https://www.foody.vn/ha-noi/kichi-kichi-lau-bang-chuyen-vincom-center-nguyen-chi-thanh,"Kichi Kichi Lẩu Băng Chuyền - Vincom Center Nguyễn Chí Thanh ở Quận Đống Đa, Hà Nội | Foody.vn","Tầng 5, Vincom Center Nguyễn Chí Thanh, 54A Nguyễn Chí Thanh, P. Láng Thượng Quận Đống Đa Hà Nội",08:00,22:00,149.000đ ,220.000,[],['8.4'],['8.6'],['8.7'],['8.5'],['8.7'],80,26,16,4,8.6,Kichi Kichi Lẩu Băng
20,20,6469fb83b1064f9440f70108,https://www.foody.vn/ha-noi/lang-bac-cafe-yen-phu,"Lãng Bạc Cafe - Ngắm nhìn Hồ Tây từ trên cao ở Quận Tây Hồ, Hà Nội | Foody.vn",52 Yên Phụ Quận Tây Hồ Hà Nội,14:00,23:00,25.000đ ,55.000,['https://images.foody.vn/res/g1/1931/prof/s576x330/foody-mobile-lb-jpg-990-635763553593787035.jpg'],['5.9'],['6.1'],['7.1'],['6.1'],['7.6'],0,7,5,2,6.6,Lãng Bạc Cafe - Ngắm
21,21,6469fb83b1064f9440f70109,https://www.foody.vn/ha-noi/co-minh-nem-lui-banh-xeo-nam-bo,"Cô Mình - Nem Lụi & Bánh Xèo Nam Bộ ở Quận Tây Hồ, Hà Nội | Foody.vn","198 Yên Phụ, P. Yên Phụ Quận Tây Hồ Hà Nội",09:00,19:00,10.000đ ,42.000,['https://images.foody.vn/res/g32/314572/prof/s576x330/foody-mobile-bs-jpg-271-636181027206849370.jpg'],['5.3'],['5.9'],['6.2'],['5.3'],['6.3'],1,6,1,4,5.8,Cô Mình - Nem Lụi & 
23,23,6469fb83b1064f9440f7010b,https://www.foody.vn/ha-noi/sumo-yakiniku-hoang-quoc-viet,"Sumo Yakiniku Hoàng Quốc Việt ở Quận Cầu Giấy, Hà Nội | Foody.vn","134 Hoàng Quốc Việt, Nghĩa Tân Quận Cầu Giấy Hà Nội",09:00,20:00,200.000đ ,330.000,['https://images.foody.vn/res/g1/594/prof/s576x330/foody-upload-api-foody-mobile-2-200910145722.jpg'],['7.2'],['7.8'],['8.1'],['7.8'],['8.1'],61,78,23,14,7.8,Sumo Yakiniku Hoàng 
24,24,6469fb83b1064f9440f7010c,https://www.foody.vn/ha-noi/bong-lan-trung-muoi-shop-online-tay-son,"Ngọc Pink - Bông Lan Trứng Muối Online ở Quận Đống Đa, Hà Nội | Foody.vn",80 Ngõ 136 Tây Sơn Quận Đống Đa Hà Nội,07:30,21:30,10.000đ ,80.000,['https://images.foody.vn/res/g26/258183/prof/s576x330/file_restaurant_photo_jfl2_16590-bd50fb77-220729104213.jpg'],['6.7'],['7.1'],['7.3'],['7.1'],['7.5'],49,98,42,36,7.2,Ngọc Pink - Bông Lan
25,25,6469fb83b1064f9440f7010d,https://www.foody.vn/ha-noi/pizza-pompeii-s-pizza-nuong-cui,"Pizza Pompeii's - Pizza Nướng Củi ở Quận Hoàng Mai, Hà Nội | Foody.vn","P10, SH04, Park Hill, KĐT Times City, 458 Minh Khai, P. Mai Động Quận Hoàng Mai Hà Nội",09:30,20:30,45.000đ ,500.000,['https://images.foody.vn/res/g71/706826/prof/s576x330/foody-mobile-pompeii-jpg.jpg'],['6.4'],['6.6'],['7.1'],['6.5'],['7.9'],2,3,4,1,6.9,Pizza Pompeii's - Pi
26,26,6469fb83b1064f9440f7010e,https://www.foody.vn/ha-noi/che-ngon-hien-dai-shop-online,"Chè Ngon Hiện Đại - Shop Online ở Quận Hoàng Mai, Hà Nội | Foody.vn","5 Ngách 7 Ngõ 204 Kim Giang, P. Đại Kim Quận Hoàng Mai Hà Nội",09:00,23:59,30.000đ ,45.000,['https://images.foody.vn/res/g105/1041600/prof/s576x330/foody-upload-api-foody-mobile-ca-89eceac1-230508140402.jpg'],['7.5'],['7.5'],['7.5'],['7.5'],['7.5'],1,0,1,0,7.5,Chè Ngon Hiện Đại - 
27,27,6469fb83b1064f9440f7010f,https://www.foody.vn/ha-noi/chao-suon-sun-doi-can,"Cúc - Cháo Sườn Sụn - Đội Cấn ở Quận Ba Đình, Hà Nội | Foody.vn",142D Đội Cấn Quận Ba Đình Hà Nội,10:00,22:00,25.000đ ,50.000,['https://images.foody.vn/res/g13/122606/prof/s576x330/image-b97c4ac1-200822063502.jpeg'],['6.0'],['6.6'],['6.6'],['6.5'],['7.2'],6,42,26,13,6.6,Cúc - Cháo Sườn Sụn 
28,28,6469fb83b1064f9440f70110,https://www.foody.vn/ha-noi/banh-mi-hoa-cuc-dunmade-shop-online,"Bánh Mì Hoa Cúc Dunmade - Shop Online ở Quận Hoàng Mai, Hà Nội | Foody.vn","69 Ngõ 337 Định Công, P. Định Công Quận Hoàng Mai Hà Nội",07:00,22:00,65.000đ ,200.000,['https://images.foody.vn/res/g26/257801/prof/s576x330/foody-mobile-13694117_10204973340-523-636044395260362328.jpg'],['7.7'],['8.4'],['8.6'],['7.8'],['8.6'],4,5,0,1,8.2,Bánh Mì Hoa Cúc Dunm
29,29,6469fb83b1064f9440f70111,https://www.foody.vn/ha-noi/tiem-an-phanh-phanh-do-han-ga-chien-online,"Tiệm Ăn Phanh Phanh - Đồ Hàn & Gà Chiên Online ở Quận Hoàng Mai, Hà Nội | Foody.vn","11 Ngõ 13 Lĩnh Nam, P. Mai Động Quận Hoàng Mai Hà Nội",09:00,21:00,5.000đ ,40.000,['https://images.foody.vn/res/g78/772766/prof/s576x330/image-145fc04d-200910115814.jpeg'],['7.6'],['8.6'],['8.6'],['8.4'],['8.8'],18,10,3,1,8.4,Tiệm Ăn Phanh Phanh 
30,30,6469fb83b1064f9440f70112,https://www.foody.vn/ha-noi/tra-sua-gong-cha-hoang-dao-thuy,"Trà Sữa Gong Cha - 貢茶 - Hoàng Đạo Thúy ở Quận Cầu Giấy, Hà Nội | Foody.vn","Tầng 1, 34T Hoàng Đạo Thúy, P. Trung Hòa Quận Cầu Giấy Hà Nội",09:30,21:30,30.000đ ,70.000,[],['7.0'],['7.2'],['7.4'],['7.2'],['7.4'],14,78,22,15,7.2,Trà Sữa Gong Cha - 貢
31,31,6469fb83b1064f9440f70113,https://www.foody.vn/ha-noi/lotteria-tran-duy-hung,"Lotteria Trần Duy Hưng: Hamburger, Gà Rán, Cơm Kẹp ở Quận Cầu Giấy, Hà Nội | Foody.vn","112 Trần Duy Hưng, P. Trung Hoà Quận Cầu Giấy Hà Nội",07:30,22:30,30.000đ ,77.000,['https://images.foody.vn/res/g1/6452/prof/s576x330/image-9bf651b4-210614103001.jpeg'],['6.1'],['6.5'],['7.0'],['6.4'],['7.1'],2,46,26,13,6.6,Lotteria Trần Duy Hư
32,32,6469fb83b1064f9440f70114,https://www.foody.vn/ha-noi/thuy-nga-com-nieu,"Thúy Nga - Cơm Niêu ở Quận Ba Đình, Hà Nội | Foody.vn",29 Nguyễn Chí Thanh Quận Ba Đình Hà Nội,08:00,22:00,50.000đ ,165.000,[],['6.0'],['7.1'],['7.2'],['6.3'],['7.7'],2,12,3,3,6.8,Thúy Nga - Cơm Niêu 
33,33,6469fb83b1064f9440f70115,https://www.foody.vn/ha-noi/quan-bo-de-tam,"Bồ Đề Tâm - Phạm Huy Thông - Ẩm Thực Chay ở Quận Ba Đình, Hà Nội | Foody.vn","34 Phạm Huy Thông, P. Ngọc Khánh Quận Ba Đình Hà Nội",09:00,21:00,50.000đ ,110.000,['https://images.foody.vn/res/g1/1076/prof/s576x330/foody-mobile-bodetam-jpg-527-636150787295248991.jpg'],['5.2'],['6.6'],['7.6'],['6.4'],['7.9'],0,10,2,2,6.7,Bồ Đề Tâm - Phạm Huy
34,34,6469fb83b1064f9440f70116,https://www.foody.vn/ha-noi/noble-moment-cafe-serendipity,"Noble Moment - Cafe' Serendipity ở Quận Cầu Giấy, Hà Nội | Foody.vn","A51 Hoàng Ngân, P. Trung Hòa Quận Cầu Giấy Hà Nội",08:00,22:00,20.000đ ,100.000,['https://images.foody.vn/res/g9/81129/prof/s576x330/foody-mobile-noble640-jpg-410-635773237464264348.jpg'],['6.2'],['7.4'],['8.1'],['7.3'],['8.3'],4,72,9,4,7.4,Noble Moment - Cafe'
35,35,6469fb83b1064f9440f70117,https://www.foody.vn/ha-noi/sumo-bbq-nha-hang-thit-nuong-nhat-ban-trung-yen,"Sumo BBQ - Nhà Hàng Thịt Nướng Nhật Bản - Trung Yên ở Quận Cầu Giấy, Hà Nội | Foody.vn","Lô 1 Nhà 12A Khu Trung Yên, P. Trung Hòa Quận Cầu Giấy Hà Nội",10:00,14:00 | 15:00 ,100.000đ ,500.000,['https://images.foody.vn/res/g76/759928/prof/s576x330/foody-upload-api-foody-mobile-8-190904105035.jpg'],['8.3'],['8.6'],['8.7'],['8.4'],['8.7'],30,6,1,6,8.5,Sumo BBQ - Nhà Hàng 
36,36,6469fb83b1064f9440f70118,https://www.foody.vn/ha-noi/lotteria-trung-kinh,"Lotteria - Trung Kính ở Quận Cầu Giấy, Hà Nội | Foody.vn","299 Trung Kính, P. Yên Hòa Quận Cầu Giấy Hà Nội",07:30,22:30,30.000đ ,110.000,['https://images.foody.vn/res/g6/53635/prof/s576x330/image-27c8017a-210614103005.jpeg'],['5.1'],['6.2'],['6.7'],['5.6'],['7.1'],1,13,12,11,6.1,Lotteria - Trung Kín
46,46,6469fb83b1064f9440f70122,https://www.foody.vn/ha-noi/vitamin-cake-shop-online,"Vitamin Cake - Shop Online ở Quận Đống Đa, Hà Nội | Foody.vn",19B Ngõ 79 Thái Thịnh Quận Đống Đa Hà Nội,08:00,21:00,70.000đ ,150.000,['https://images.foody.vn/res/g21/204282/prof/s576x330/foody-mobile-vita0-jpg-930-635882803720707455.jpg'],['6.4'],['6.7'],['7.1'],['6.6'],['7.3'],6,97,22,18,6.8,Vitamin Cake - Shop 
48,48,6469fb83b1064f9440f70124,https://www.foody.vn/ha-noi/fairy-foods-drinks,"Tiệm Bánh Bông Lan Trứng Muối Fairy - Shop Online ở Quận Đống Đa, Hà Nội | Foody.vn","108 Ngõ 1194 Đường Láng, P. Láng Thượng Quận Đống Đa Hà Nội",08:30,21:00,8.000đ ,60.000,['https://images.foody.vn/res/g77/766082/prof/s576x330/foody-upload-api-foody-mobile-banh-190422120020.jpg'],['6.7'],['7.0'],['7.2'],['6.9'],['7.4'],44,54,29,29,7.0,Tiệm Bánh Bông Lan T
49,49,6469fb83b1064f9440f70125,https://www.foody.vn/ha-noi/buffet-sen-ly-thai-to,"Buffet Sen - Lý Thái Tổ ở Quận Hoàn Kiếm, Hà Nội | Foody.vn","60 Lý Thái Tổ, P. Tràng Tiền Quận Hoàn Kiếm Hà Nội",09:00,23:00,295.000đ ,395.000,['https://images.foody.vn/res/g1/417/prof/s576x330/foody-mobile-buffet-sen-ly-thai-to-ha-noi-140225115808.jpg'],['6.8'],['7.6'],['7.6'],['7.6'],['8.1'],11,93,22,4,7.5,Buffet Sen - Lý Thái
50,50,6469fb83b1064f9440f70126,https://www.foody.vn/ha-noi/gogi-house-nuong-han-quoc-water-mark,"GoGi House - Nướng Hàn Quốc - Water Mark ở Quận Tây Hồ, Hà Nội | Foody.vn","Chung Cư Water Mark, 395 Lạc Long Quân Quận Tây Hồ Hà Nội",09:00,22:00,270.000đ ,500.000,[],['8.2'],['8.6'],['8.6'],['8.3'],['8.8'],69,15,9,10,8.5,GoGi House - Nướng H
51,51,6469fb83b1064f9440f70127,https://www.foody.vn/ha-noi/nghien-lau-buffet,"Nghiện Lẩu Buffet ở Quận Hai Bà Trưng, Hà Nội | Foody.vn","2B Ngõ Bà Triệu, Bà Triệu Quận Hai Bà Trưng Hà Nội",11:00,14:00 | 18:00 ,127.000đ ,157.000,['https://images.foody.vn/res/g22/216458/prof/s576x330/foody-mobile-nghien-jpg-443-636331379645792657.jpg'],['5.9'],['6.5'],['7.1'],['6.3'],['7.1'],0,26,16,7,6.6,Nghiện Lẩu Buffet ở 
52,52,6469fb83b1064f9440f70128,https://www.foody.vn/ha-noi/seoul-garden-tran-hung-dao,"Nhà hàng Seoul Garden - Buffet trưa với Pepsi tươi ở Quận Hoàn Kiếm, Hà Nội | Foody.vn","33 Trần Hưng Đạo, P. Phan Chu Trinh Quận Hoàn Kiếm Hà Nội",08:00,23:00,250.000đ ,440.000,['https://images.foody.vn/res/g1/6533/prof/s576x330/foody-mobile-sg1-jpg-692-635769630631824043.jpg'],['6.2'],['7.1'],['7.3'],['6.9'],['7.7'],3,46,21,4,7.0,Nhà hàng Seoul Garde
53,53,6469fb83b1064f9440f70129,https://www.foody.vn/ha-noi/huong-sen,"Nhà Hàng Hương Sen - Buffet Hải Sản Cao Cấp ở Quận Nam Từ Liêm, Hà Nội | Foody.vn","269 Đỗ Đức Dục, Mễ Trì Quận Nam Từ Liêm Hà Nội",10:00,22:00,30.000đ ,550.000,['https://images.foody.vn/res/g1/846/prof/s576x330/foody-mobile-huong-sen-jpg-886-635841338923288386.jpg'],['7.4'],['7.7'],['7.8'],['7.6'],['8.0'],26,31,14,8,7.7,Nhà Hàng Hương Sen -
54,54,6469fb83b1064f9440f7012a,https://www.foody.vn/ha-noi/uu-dam-chay,"Ưu Đàm Chay ở Quận Hoàn Kiếm, Hà Nội | Foody.vn",34 Hàng Bài Quận Hoàn Kiếm Hà Nội,07:00,23:00,60.000đ ,285.000,['https://images.foody.vn/res/g23/223001/prof/s576x330/foody-mobile-chay-jpg-203-636053175307823559.jpg'],['6.2'],['7.6'],['8.0'],['7.4'],['8.1'],20,73,7,12,7.5,Ưu Đàm Chay ở Quận H
55,55,6469fb83b1064f9440f7012b,https://www.foody.vn/ha-noi/seoul-bbq-nguyen-truong-to,"Seoul BBQ - Ẩm thực xứ Hàn đúng kiểu ở Quận Ba Đình, Hà Nội | Foody.vn",24 - 26 Nguyễn Trường Tộ Quận Ba Đình Hà Nội,11:00,14:00 | 17:30 ,100.000đ ,250.000,['https://images.foody.vn/res/g14/131024/prof/s576x330/foody-mobile-nuong1-jpg-566-635923528684489027.jpg'],['7.0'],['7.1'],['7.2'],['7.1'],['7.4'],10,78,29,11,7.2,Seoul BBQ - Ẩm thực 
56,56,6469fb83b1064f9440f7012c,https://www.foody.vn/ha-noi/habit-bbq-lau-nuong-khong-khoi,"Habit BBQ - Lẩu Nướng Không Khói ở Quận Cầu Giấy, Hà Nội | Foody.vn","1A Dịch Vọng Hậu, P. Dịch Vọng Hậu Quận Cầu Giấy Hà Nội",10:30,21:30,150.000đ ,300.000,[],['6.8'],['6.9'],['6.9'],['6.8'],['7.2'],15,74,27,20,6.9,Habit BBQ - Lẩu Nướn
57,57,6469fb83b1064f9440f7012d,https://www.foody.vn/ha-noi/cgv-vincom-ba-trieu,"CGV - Vincom Bà Triệu ở Quận Hai Bà Trưng, Hà Nội | Foody.vn","Tầng 6, Vincom Bà Triệu, 191 Bà Triệu  Quận Hai Bà Trưng Hà Nội",08:30,23:59,80.000đ ,250.000,['https://images.foody.vn/res/g8/72116/prof/s576x330/foody-upload-api-foody-mobile-vincom-ba-trieu-190318172338.jpg'],['6.6'],['7.8'],['7.8'],['7.1'],['7.9'],11,118,27,5,7.4,CGV - Vincom Bà Triệ
58,58,6469fb83b1064f9440f7012e,https://www.foody.vn/ha-noi/cha-ca-thang-long,"Chả Cá Thăng Long - Đặc sản Cố Đô ở Quận Hoàn Kiếm, Hà Nội | Foody.vn","2D - 19 - 21 Đường Thành, P. Cửa Đông Quận Hoàn Kiếm Hà Nội",08:45,22:30,30.000đ ,66.000,['https://images.foody.vn/res/g1/1091/prof/s576x330/foody-mobile-cha-ca-thang-long-jp-543-635788166419499520.jpg'],['6.9'],['7.4'],['7.7'],['7.1'],['7.9'],11,93,27,5,7.4,Chả Cá Thăng Long - 
62,62,6469fb83b1064f9440f70132,https://www.foody.vn/ha-noi/nha-coffee-restaurant-vintage-house-nguyen-khac-can,"Nhà Coffee & Restaurant - Vintage House - Nguyễn Khắc Cần ở Quận Hoàn Kiếm, Hà Nội | Foody.vn","9 Nguyễn Khắc Cần, P. Hàng Bài Quận Hoàn Kiếm Hà Nội",07:00,23:00,50.000đ ,200.000,['https://images.foody.vn/res/g12/118015/prof/s576x330/foody-mobile-nha-coffee-jpg-269-635779053205369131.jpg'],['5.9'],['7.2'],['7.7'],['6.9'],['8.5'],11,85,26,9,7.2,Nhà Coffee & Restaur
67,67,6469fb83b1064f9440f70137,https://www.foody.vn/ha-noi/maison-sens-tran-hung-dao,"Nhà Hàng Buffet Maison Sens ở Quận Hoàn Kiếm, Hà Nội | Foody.vn","61 Trần Hưng Đạo, P. Trần Hưng Đạo Quận Hoàn Kiếm Hà Nội",11:00,14:00 | 18:00 ,50.000đ ,1.650.000,['https://images.foody.vn/res/g2/10175/prof/s576x330/foody-mobile-sen1-jpg-508-635762628711686566.jpg'],['7.1'],['8.2'],['8.2'],['8.0'],['8.2'],10,78,4,1,7.9,Nhà Hàng Buffet Mais
70,70,6469fb83b1064f9440f7013a,https://www.foody.vn/ha-noi/beto-bistro-tealounge-hai-ba-trung,"Bêtô Bistro & Tealounge - Hai Bà Trưng ở Quận Hoàn Kiếm, Hà Nội | Foody.vn","1B Hai Bà Trưng, P. Phan Chu Trinh Quận Hoàn Kiếm Hà Nội",07:00,23:30,25.000đ ,85.000,['https://images.foody.vn/res/g10/94274/prof/s576x330/foody-mobile-beto-mb-jpg-243-635812144799648341.jpg'],['6.8'],['7.5'],['8.1'],['7.4'],['8.1'],5,33,11,1,7.6,Bêtô Bistro & Tealou
71,71,6469fb83b1064f9440f7013b,https://www.foody.vn/ha-noi/nighteen-buffet-lau,"Nighteen - Buffet Lẩu ở Quận Cầu Giấy, Hà Nội | Foody.vn","Tầng 19A, 169 Nguyễn Ngọc Vũ Quận Cầu Giấy Hà Nội",18:00,23:00,119.000đ ,119.000,[],['7.0'],['7.5'],['7.5'],['7.4'],['8.2'],13,28,9,7,7.5,Nighteen - Buffet Lẩ
72,72,6469fb83b1064f9440f7013c,https://www.foody.vn/ha-noi/don-chicken-chicken-pub-kdt-mon-city/binh-luan-12417687,"Don Chicken - Chicken & Pub - KĐT Mon City ở Quận Nam Từ Liêm, Hà Nội | Bình luận - Don Chicken - KĐT Mon City | Ngọc Phạm | Foody.vn","TT04 - 32, KĐT Mon City, 4 Hàm Nghi, P. Mỹ Đình 2 Quận Nam Từ Liêm Hà Nội",11:00,22:30,50.000đ ,300.000,['https://images.foody.vn/res/g75/748258/prof/s576x330/file_restaurant_photo_tpdk_16784-9aedfebb-230310203343.jpg'],['7.0'],['7.6'],['7.6'],['7.4'],['7.8'],5,23,6,3,7.5,Don Chicken - Chicke
73,73,6469fb83b1064f9440f7013d,https://www.foody.vn/ha-noi/dakgalbi-tiem-ga-ran-han-quoc/binh-luan-15796835,"Dakgalbi - Tiệm Gà Rán Hàn Quốc ở Quận Đống Đa, Hà Nội | Bình luận - Cũng ok | Batie Cassie | Foody.vn",3 Ngõ 87 Láng Hạ Quận Đống Đa Hà Nội,09:30,22:00,50.000đ ,300.000,['https://images.foody.vn/res/g23/228521/prof/s576x330/image-f3a3eb16-200910115812.jpeg'],['6.3'],['7.4'],['7.4'],['7.1'],['7.5'],4,52,17,6,7.1,Dakgalbi - Tiệm Gà R
74,74,6469fb83b1064f9440f7013e,https://www.foody.vn/ha-noi/papa-s-chicken-pizza-the-manor/binh-luan-13755244,"Papa's Chicken & Pizza - The Manor ở Quận Nam Từ Liêm, Hà Nội | Bình luận - Ngon, sốt rõ vị ngọt của mật ong | Hải Lê | Foody.vn","Tầng 1,  Tầng 1, B004 The Manor, Mễ Trì ",10:00,23:00,30.000đ ,150.000,[],['6.6'],['7.3'],['7.5'],['6.8'],['7.8'],9,104,24,10,7.2,Papa's Chicken & Piz
75,75,6469fb83b1064f9440f7013f,https://www.foody.vn/ha-noi/cube-beefsteak-drinks-bo-bit-tet-kieu-phap/binh-luan-8847302,"Cube Beefsteak & Drinks - Bò Bít Tết Kiểu Pháp ở Quận Đống Đa, Hà Nội | Bình luận - Đồ ăn ngon, địa điểm check in hợp lí | Snow Wind Aladaide | Foody",20 Ngõ 211 Xã Đàn Quận Đống Đa Hà Nội,10:30,22:00,35.000đ ,120.000,['https://images.foody.vn/res/g14/135459/prof/s576x330/foody-mobile-hmb-h-jpg-897-635786260010129746.jpg'],['6.9'],['7.4'],['7.4'],['7.2'],['7.7'],15,150,38,9,7.3,Cube Beefsteak & Dri
91,91,6469fb83b1064f9440f7014f,https://www.foody.vn/ha-noi/tom-karaoke-bui-thi-xuan,"Tôm Karaoke - Bùi Thị Xuân ở Quận Hai Bà Trưng, Hà Nội | Foody.vn",116 Bùi Thị Xuân Quận Hai Bà Trưng Hà Nội,08:00,23:00,100.000đ ,200.000,['https://images.foody.vn/res/g6/55236/prof/s576x330/foody-mobile-640x400_tom-karaoke--914-635721346061568081.jpg'],['7.7'],['8.0'],['8.0'],['7.8'],['8.1'],5,46,3,2,7.9,Tôm Karaoke - Bùi Th
92,92,6469fb83b1064f9440f70150,https://www.foody.vn/ha-noi/paku-paku-japanese-restaurant,"Paku Paku - Japanese Restaurant ở Quận Ba Đình, Hà Nội | Foody.vn",35 Linh Lang Quận Ba Đình Hà Nội,10:00,01:00,20.000đ ,250.000,['https://images.foody.vn/res/g8/73041/prof/s576x330/foody-mobile-paku-jpg-747-636052112505961761.jpg'],['8.0'],['8.9'],['8.9'],['8.1'],['9.3'],7,8,0,1,8.6,Paku Paku - Japanese
93,93,6469fb83b1064f9440f70151,https://www.foody.vn/ha-noi/sofitel-metropole-hanoi-hotel,"Sofitel Metropole Hanoi Hotel ở Quận Hoàn Kiếm, Hà Nội | Foody.vn","15 Ngô Quyền, P. Tràng Tiền Quận Hoàn Kiếm Hà Nội",00:00,23:30,500.000đ ,3.000.000,['https://images.foody.vn/res/g10/91286/prof/s576x330/foody-mobile-metropol-jpg-635447561715137560.jpg'],['7.1'],['8.7'],['9.0'],['8.6'],['9.3'],8,8,2,0,8.5,Sofitel Metropole Ha
94,94,6469fb83b1064f9440f70152,https://www.foody.vn/ha-noi/lau-cua-song-h2t-kcn-bac-thang-long,"Lẩu Cua Sông H2T - KCN Bắc Thăng Long ở Huyện Đông Anh, Hà Nội | Foody.vn","Cổng C, Khu Công Nghiệp Bắc Thăng Long Huyện Đông Anh Hà Nội",10:00,23:00,30.000đ ,350.000,['https://images.foody.vn/res/g16/150133/prof/s576x330/foody-mobile-40-jpg-142-635720582681871276.jpg'],['6.0'],['7.7'],['8.0'],['7.0'],['8.4'],1,14,4,1,7.4,Lẩu Cua Sông H2T - K
95,95,6469fb83b1064f9440f70153,https://www.foody.vn/ha-noi/cutisun-restaurant-2-bo-bit-tet,"Cutisun Restaurant 2 - Bò Bít Tết ở Quận Cầu Giấy, Hà Nội | Foody.vn","38 Đỗ Quang, P. Trung Hòa Quận Cầu Giấy Hà Nội",10:00,21:00,50.000đ ,500.000,['https://images.foody.vn/res/g26/257665/prof/s576x330/foody-mobile-13720985_10203968913-657-636046977580591750.jpg'],['6.5'],['7.1'],['7.7'],['6.8'],['7.8'],1,27,9,4,7.2,Cutisun Restaurant 2
96,96,6469fb83b1064f9440f70154,https://www.foody.vn/ha-noi/pullman-hotel-cat-linh,"Pullman Hotel - Cát Linh ở Quận Đống Đa, Hà Nội | Foody.vn","40 Cát Linh, P. Cát Linh Quận Đống Đa Hà Nội",00:00,23:30,500.000đ ,5.000.000,['https://images.foody.vn/res/g10/91528/prof/s576x330/foody-mobile-pullman-jpg-116-636186858675221859.jpg'],['6.6'],['7.4'],['7.6'],['6.8'],['8.1'],0,10,4,0,7.3,Pullman Hotel - Cát 
97,97,6469fb83b1064f9440f70155,https://www.foody.vn/ha-noi/wabi-sabi-vuon-nhat,"Wabi Sabi Vườn Nhật ở Quận Hai Bà Trưng, Hà Nội | Foody.vn","15 Tô Hiến Thành, P. Bùi Thị Xuân Quận Hai Bà Trưng Hà Nội",10:30,02:30 | 17:30 ,100.000đ ,220.000,['https://images.foody.vn/res/g1/75/prof/s576x330/file_restaurant_photo_s9zg_16052-9d401050-201113165051.jpg'],['4.8'],['6.1'],['6.7'],['6.1'],['7.1'],0,8,5,3,6.2,Wabi Sabi Vườn Nhật 
99,99,6469fb83b1064f9440f70157,https://www.foody.vn/ha-noi/buffet-sen-viet-sahul-ha-noi,"Buffet Sen Việt - Sahul Hà Nội ở Quận Hai Bà Trưng, Hà Nội | Foody.vn",684 Minh Khai  Quận Hai Bà Trưng Hà Nội,11:00,21:30,250.000đ ,280.000,['https://images.foody.vn/res/g15/142130/prof/s576x330/foody-mobile-b2-jpg-887-635694410498495875.jpg'],['6.4'],['6.8'],['7.2'],['6.5'],['7.4'],1,9,4,3,6.9,Buffet Sen Việt - Sa
100,100,6469fb83b1064f9440f70158,https://www.foody.vn/ha-noi/bien-dong,"Hải Sản Biển Đông - Trần Thái Tông ở Quận Cầu Giấy, Hà Nội | Foody.vn","2 Ngõ 84 Trần Thái Tông, P. Dịch Vọng Hậu Quận Cầu Giấy Hà Nội",10:30,14:00 | 17:00 ,300.000đ ,550.000,['https://images.foody.vn/res/g1/660/prof/s576x330/foody-upload-api-foody-mobile-p8-jpg-180928173000.jpg'],['6.6'],['7.2'],['7.3'],['7.1'],['7.5'],7,27,12,6,7.1,Hải Sản Biển Đông - 
102,102,6469fb83b1064f9440f7015a,https://www.foody.vn/ha-noi/new-york-sport-bar-mon-an-au-a-ba-trieu,"New York Sport Bar - Món Ăn Âu & Á - Bà Triệu ở Quận Hoàn Kiếm, Hà Nội | Foody.vn",38 Bà Triệu Quận Hoàn Kiếm Hà Nội,07:00,22:00,50.000đ ,500.000,['https://images.foody.vn/res/g13/126121/prof/s576x330/foody-upload-api-foody-mobile-foody-upload-api-foo-200526165502.jpg'],['6.5'],['8.0'],['8.3'],['7.9'],['8.4'],4,64,6,1,7.8,New York Sport Bar -
103,103,6469fb83b1064f9440f7015b,https://www.foody.vn/ha-noi/it-cream,"Tiệm Bánh IT - Lê Thanh Nghị ở Quận Hai Bà Trưng, Hà Nội | Foody.vn","64 - 66 Lê Thanh Nghị, P. Bách Khoa Quận Hai Bà Trưng Hà Nội",07:00,22:30,35.000đ ,77.000,['https://images.foody.vn/res/g1/3146/prof/s576x330/foody-mobile-itcream-jpg-800-635851636790837735.jpg'],['6.3'],['6.4'],['7.3'],['6.4'],['7.6'],11,50,43,18,6.8,Tiệm Bánh IT - Lê Th
104,104,6469fb83b1064f9440f7015c,https://www.foody.vn/ha-noi/bamboo-bar-sofitel-legend-metropole-hanoi,"Bamboo Bar - Sofitel Legend Metropole Hanoi ở Quận Hoàn Kiếm, Hà Nội | Foody.vn",15 Ngô Quyền Quận Hoàn Kiếm Hà Nội,18:00,01:00,100.000đ ,500.000,['https://images.foody.vn/res/g3/25066/prof/s576x330/foody-mobile-bamboo-bar-ha-noi.jpg'],['6.6'],['8.4'],['8.4'],['8.2'],['8.6'],0,5,0,0,8.0,Bamboo Bar - Sofitel
105,105,6469fb83b1064f9440f7015d,https://www.foody.vn/ha-noi/mint-bar-pullman-hanoi-hotel,"Mint Bar - Pullman Hanoi Hotel ở Quận Đống Đa, Hà Nội | Foody.vn",40 Cát Linh Quận Đống Đa Hà Nội,07:00,23:30,100.000đ ,500.000,['https://images.foody.vn/res/g15/141137/prof/s576x330/foody-mobile-mint-jpg-643-635820554570280456.jpg'],['7.5'],['7.5'],['7.5'],['7.5'],['7.5'],0,2,0,0,7.5,Mint Bar - Pullman H
