,Unnamed: 0,_id,url,title,address,time_start,time_end,price_start,price_end,image,score_space,score_quality,score_price,score_service,score_location,total_score_comment_for_excellent,total_score_comment_for_good,total_score_comment_for_avg,total_score_comment_for_bad,avg_score_comment,title_first_chars
4176,4176,6469fb83b1064f9440f71144,https://www.foody.vn/ha-noi/tra-sua-kai-tea-van-phu/binh-luan-3322795,"Trà Sữa Kai Tea - Hà Trì ở Quận Hà Đông, Hà Nội | Bình luận - Trà Sữa Kai Tea - Văn Phú | Lười Ỉn | Foody.vn","35 LK22 Hà Trì, P. Hà Cầu Quận Hà Đông Hà Nội",09:00,22:30,25.000đ ,50.000,['https://images.foody.vn/res/g89/881531/prof/s576x330/foody-upload-api-foody-mobile-kai-190115165406.jpg'],['7.6'],['8.6'],['8.8'],['8.5'],['9.1'],3,8,0,0,8.5,Trà Sữa Kai Tea - Hà
4178,4178,6469fb83b1064f9440f71146,https://www.foody.vn/ha-noi/oyama-tra-sua-hotdog/binh-luan-6589401,"Oyama - Trà Sữa & Hotdog ở Quận Nam Từ Liêm, Hà Nội | Bình luận - Oyama - Trà Sữa & Hotdog | Linh Diệu | Foody.vn",19B Ngõ 179 Đình Thôn Quận Nam Từ Liêm Hà Nội,10:00,22:00,35.000đ ,60.000,['https://images.foody.vn/res/g104/1031389/prof/s576x330/foody-upload-api-foody-mobile-c1-200622110944.jpg'],['8.1'],['8.4'],['9.6'],['8.1'],['9.7'],4,7,0,0,8.8,Oyama - Trà Sữa & Ho
4179,4179,6469fb83b1064f9440f71147,https://www.foody.vn/ha-noi/phim-truong-smiley-ville-dong-hoi/binh-luan-2158829,"Phim Trường Smiley Ville - Đông Hội ở Huyện Đông Anh, Hà Nội | Bình luận - Trải nghiệm phim trường lớn nhất miền Bắc chỉ cách Trung tâm Hà Nội khoảng ",Đông Hội Huyện Đông Anh Hà Nội,08:00,18:00,500.000đ ,2.000.000,['https://images.foody.vn/res/g17/168414/prof/s576x330/foody-mobile-smiley1-jpg-592-635780003577914372.jpg'],['7.5'],['9.0'],['9.0'],['7.5'],['9.8'],1,3,0,0,8.6,Phim Trường Smiley V
4196,4196,6469fb83b1064f9440f71158,https://www.foody.vn/ha-noi/blackyard-coffee/binh-luan-11332193,"Backyard Coffee ở Quận Đống Đa, Hà Nội | Bình luận - Backyard Coffee | Quỳnhchi Nguyễn | Foody.vn","33A Ngõ 41 Thái Hà, P. Trung Liệt Quận Đống Đa Hà Nội",08:00,22:00,20.000đ ,60.000,['https://images.foody.vn/res/g90/893814/prof/s576x330/foody-upload-api-foody-mobile-111-190313150335.jpg'],['6.8'],['7.1'],['7.4'],['7.1'],['8.4'],0,13,2,0,7.4,Backyard Coffee ở Qu
4198,4198,6469fb83b1064f9440f7115a,https://www.foody.vn/ha-noi/laika-cafe-trung-hoa/binh-luan-10903447,"Laika Cafe - Trung Hòa ở Quận Cầu Giấy, Hà Nội | Bình luận - Laika Cafe - Trung Hòa | Quỳnhchi Nguyễn | Foody.vn","91 Trung Hòa, P. Yên Hòa Quận Cầu Giấy Hà Nội",07:00,23:00,25.000đ ,55.000,['https://images.foody.vn/res/g106/1053631/prof/s576x330/foody-upload-api-foody-mobile-co-3ca68581-230519123339.jpeg'],['7.3'],['8.5'],['8.8'],['8.0'],['8.8'],1,3,0,0,8.3,Laika Cafe - Trung H
4199,4199,6469fb83b1064f9440f7115b,https://www.foody.vn/ha-noi/tiem-thang-nam-lang-ha/binh-luan-9621633,"Tiệm Tháng Năm - Láng Hạ ở Quận Đống Đa, Hà Nội | Bình luận - Tiệm Tháng Năm - Láng Hạ | Rin Nguyễn | Foody.vn","11 Ngõ 36 Láng Hạ, P. Láng Hạ Quận Đống Đa Hà Nội",07:00,21:00,15.000đ ,35.000,['https://images.foody.vn/res/g104/1038771/prof/s576x330/file_restaurant_photo_r6gr_16318-acc39f9d-210917192543.jpg'],['7.5'],['9.0'],['9.5'],['8.0'],['10.0'],1,1,0,0,8.8,Tiệm Tháng Năm - Lán
4200,4200,6469fb83b1064f9440f7115c,https://www.foody.vn/ha-noi/manoir-cafe,"Manoir Café ở Quận Hoàn Kiếm, Hà Nội | Foody.vn","1A Nguyễn Gia Thiều  Nguyễn Gia Thiều, Trần Hưng Đạo Quận Hoàn Kiếm Hà Nội",08:00,22:30,30.000đ ,80.000,['https://images.foody.vn/res/g100/998633/prof/s576x330/file_b35016de-f39e-4442-b303-321-e4977914-211030102146.jpeg'],['6.7'],['7.7'],['7.7'],['7.0'],['8.0'],0,2,1,0,7.4,Manoir Café ở Quận H
4203,4203,6469fb83b1064f9440f7115f,https://www.foody.vn/ha-noi/chops-hops-wheat-meat,"Chops - Hops, Wheat & Meat - Quảng An ở Quận Tây Hồ, Hà Nội | Foody.vn","4 Quảng An, P. Quảng An Quận Tây Hồ Hà Nội",11:00,21:00,50.000đ ,100.000,['https://images.foody.vn/res/g20/193090/prof/s576x330/foody-mobile-17425981_18917204210.jpg'],['7.1'],['8.0'],['8.0'],['7.7'],['8.2'],6,27,3,1,7.8,"Chops - Hops, Wheat "
4206,4206,6469fb83b1064f9440f71162,https://www.foody.vn/ha-noi/kfc-lang-ha/binh-luan-16502843,"Gà Rán KFC - Láng Hạ ở Quận Đống Đa, Hà Nội | Bình luận - Gà Rán KFC - Láng Hạ | Ha Thanh | Foody.vn","173 - 175 Láng Hạ, P. Láng Hạ Quận Đống Đa Hà Nội",09:00,22:00,30.000đ ,88.000,['https://images.foody.vn/res/g1/6276/prof/s576x330/image-22bf505c-220812160709.jpg'],['6.7'],['6.9'],['7.2'],['6.8'],['7.5'],5,51,21,6,7.0,Gà Rán KFC - Láng Hạ
4208,4208,6469fb83b1064f9440f71164,https://www.foody.vn/ha-noi/pepperonis-restaurant-giang-vo/binh-luan-12797096,"Pepperonis Pizza - Giảng Võ ở Quận Ba Đình, Hà Nội | Bình luận - Pepperonis Pizza - Giảng Võ | hung | Foody.vn","123 K1 Giảng Võ, P. Giảng Võ Quận Ba Đình Hà Nội",10:00,21:30,30.000đ ,220.000,['https://images.foody.vn/res/g1/6124/prof/s576x330/foody-upload-api-foody-mobile-p3-jpg-181129104850.jpg'],['7.1'],['7.7'],['7.8'],['7.4'],['7.9'],2,76,9,2,7.6,Pepperonis Pizza - G
4209,4209,6469fb83b1064f9440f71165,https://www.foody.vn/ha-noi/argento-cafe/binh-luan-9204183,"Argento Cafe ở Quận Hoàn Kiếm, Hà Nội | Bình luận - Argento Cafe | Yến Nhi Vương | Foody.vn","6 Lê Thánh Tông, P. Phan Chu Trinh Quận Hoàn Kiếm Hà Nội",07:00,22:00,20.000đ ,55.000,['https://images.foody.vn/res/g3/20991/prof/s576x330/foody-mobile-hmb-t-jpg-754-635778371325051472.jpg'],['7.1'],['7.6'],['7.7'],['7.2'],['7.7'],3,54,14,1,7.5,Argento Cafe ở Quận 
4225,4225,6469fb83b1064f9440f71175,https://www.foody.vn/ha-noi/trau-ngon-quan-trau-tuoi-giat-tu-son,"Trâu Ngon Quán - Trâu Tươi Giật Từ Sơn ở Quận Hà Đông, Hà Nội | Foody.vn","KĐT An Hưng, Tố Hữu Quận Hà Đông Hà Nội",09:00,22:00,30.000đ ,300.000,[],['7.6'],['8.0'],['8.9'],['7.9'],['8.9'],5,11,0,0,8.2,Trâu Ngon Quán - Trâ
4236,4236,6469fb83b1064f9440f71180,https://www.foody.vn/ha-noi/tit-lau-lau-thai-tomo-yum-lau-rieu-suon-sun,"Tít Lẩu - Lẩu Thái Tomo Yum & Lẩu Riêu Sườn Sụn ở Quận Ba Đình, Hà Nội | Foody.vn","41 Phạm Hồng Thái, P. Trúc Bạch Quận Ba Đình Hà Nội",10:00,22:30,20.000đ ,350.000,[],['7.2'],['7.8'],['7.8'],['7.4'],['8.0'],0,5,0,0,7.6,Tít Lẩu - Lẩu Thái T
4239,4239,6469fb83b1064f9440f71183,https://www.foody.vn/ha-noi/tuan-beo-ga-hap-la-chanh,"Tuấn Béo - Gà Hấp Lá Chanh ở Quận Bắc Từ Liêm, Hà Nội | Foody.vn",140 Cổ Nhuế 2 Quận Bắc Từ Liêm Hà Nội,10:00,23:00,28.000đ ,175.000,['https://images.foody.vn/res/g77/764045/prof/s576x330/foody-upload-api-foody-mobile-ga-190606091856.jpg'],['8.0'],['9.0'],['9.3'],['8.7'],['9.7'],3,3,0,0,8.9,Tuấn Béo - Gà Hấp Lá
4240,4240,6469fb83b1064f9440f71184,https://www.foody.vn/ha-noi/vy-cafe-cafe-fastfood/binh-luan-1296941,"Vy Cafe - Cafe & Fastfood ở Quận Hoàn Kiếm, Hà Nội | Bình luận - THOÁNG | Fall Fin | Foody.vn",3A Vọng Đức Quận Hoàn Kiếm Hà Nội,07:00,22:00,15.000đ ,35.000,['https://images.foody.vn/res/g22/211917/prof/s576x330/foody-mobile-cf-vy-jpg-516-635955594221563825.jpg'],['8.0'],['8.0'],['8.0'],['8.0'],['8.0'],0,1,0,0,8.0,Vy Cafe - Cafe & Fas
4241,4241,6469fb83b1064f9440f71185,https://www.foody.vn/ha-noi/da-lat-quan-sua-tuoi-tran-chau-duong-den/binh-luan-16438797,"Đà Lạt Quán - Sữa Tươi Trân Châu Đường Đen ở Quận Đống Đa, Hà Nội | Bình luận - Đà Lạt Quán - Sữa Tươi Trân Châu Đường Đen | Vân Huyền Phạm | Foody.vn","37 Ngõ 161 Thái Hà, P. Láng Hạ Quận Đống Đa Hà Nội",09:00,22:00,22.000đ ,28.000,['https://images.foody.vn/res/g88/875281/prof/s576x330/foody-upload-api-foody-mobile-2-jpg-190103102211.jpg'],['5.6'],['7.9'],['8.0'],['6.6'],['8.7'],2,5,3,1,7.4,Đà Lạt Quán - Sữa Tư
4244,4244,6469fb83b1064f9440f71188,https://www.foody.vn/ha-noi/la-mensa,"La Mensa ở Quận Đống Đa, Hà Nội | Foody.vn","8 Ngõ 165 Thái Hà, P. Láng Hạ Quận Đống Đa Hà Nội",07:00,22:00,25.000đ ,50.000,['https://images.foody.vn/res/g99/988391/prof/s576x330/foody-upload-api-foody-mobile-78732774_11774903969-191210113722.jpg'],['7.4'],['8.0'],['8.0'],['7.8'],['9.0'],0,5,0,0,8.0,La Mensa ở Quận Đống
4245,4245,6469fb83b1064f9440f71189,https://www.foody.vn/ha-noi/net-hue-thai-ha/binh-luan-3089881,"Nét Huế ở Quận Đống Đa, Hà Nội | Bình luận - Chưa đánh giá chỗ nào nhưng nay phải nhảy vào vì quá thất vọng | dương mochi | Foody.vn","34 - 36 Thái Hà, P. Trung Liệt Quận Đống Đa Hà Nội",08:00,22:00,50.000đ ,150.000,['https://images.foody.vn/res/g22/216915/prof/s576x330/foody-upload-api-foody-mobile-net-hue-191107093917.jpg'],['6.5'],['6.8'],['7.3'],['6.5'],['7.5'],3,30,13,4,6.9,Nét Huế ở Quận Đống 
4280,4280,6469fb83b1064f9440f711ac,https://www.foody.vn/ha-noi/net-hue-nguyen-khanh-toan/binh-luan-15197771,"Nét Huế - Nguyễn Văn Huyên ở Quận Cầu Giấy, Hà Nội | Bình luận - Nét Huế -*** | kyduyennguyen6396 | Foody.vn","Lô 4 Nhà D1 KĐT Mới Dịch Vọng Hậu (Ngã Tư Nguyễn Khánh Toàn - Nguyễn Văn Huyên), P. Dịch Vọng Quận Cầu Giấy Hà Nội",07:00,22:00,50.000đ ,150.000,['https://images.foody.vn/res/g29/283336/prof/s576x330/foody-upload-api-foody-mobile-net-hue-191107093934.jpg'],['6.5'],['7.5'],['7.6'],['7.0'],['7.6'],2,16,3,2,7.3,Nét Huế - Nguyễn Văn
4281,4281,6469fb83b1064f9440f711ad,https://www.foody.vn/ha-noi/net-hue-lang-ha/binh-luan-11788113,"Nét Huế - Láng Hạ ở Quận Đống Đa, Hà Nội | Bình luận - Chất lượng món ăn giảm đi, có lẽ vì Covid-19 | Thăng Ngô | Foody.vn","153 Láng Hạ, P. Láng Hạ Quận Đống Đa Hà Nội",07:00,22:00,35.000đ ,55.000,['https://images.foody.vn/res/g1/6067/prof/s576x330/foody-upload-api-foody-mobile-net-hue-191107093926.jpg'],['6.3'],['6.7'],['6.8'],['6.7'],['7.1'],1,87,37,17,6.7,Nét Huế - Láng Hạ ở 
4282,4282,6469fb83b1064f9440f711ae,https://www.foody.vn/ha-noi/mien-luon-dong-thai-ha/binh-luan-16963288,"Miến Lươn Đồng - Thái Hà ở Quận Đống Đa, Hà Nội | Bình luận - Trải nghiệm siêu tệ | Hoàng Wuyss | Foody.vn",42 Thái Hà Quận Đống Đa Hà Nội,06:30,21:30,20.000đ ,55.000,[],['6.4'],['6.6'],['6.7'],['6.6'],['7.3'],1,54,22,8,6.7,Miến Lươn Đồng - Thá
4287,4287,6469fb83b1064f9440f711b3,https://www.foody.vn/ha-noi/net-hue-tran-duy-hung/binh-luan-13659549,"Nét Huế - Trần Duy Hưng ở Quận Cầu Giấy, Hà Nội | Bình luận - Nét Huế - Trần Duy Hưng | Mỹ Anh Nguyễn | Foody.vn","83 Trần Duy Hưng, P. Trung Hòa Quận Cầu Giấy Hà Nội",08:00,22:00,200.000đ ,2.000.000,['https://images.foody.vn/res/g13/127222/prof/s576x330/foody-upload-api-foody-mobile-net-hue-191107093929.jpg'],['5.8'],['6.5'],['6.8'],['6.1'],['7.1'],6,40,20,21,6.5,Nét Huế - Trần Duy H
4288,4288,6469fb83b1064f9440f711b4,https://www.foody.vn/ha-noi/bun-bo-hue-o-uong,"Bún Bò Huế O Uông - Lạc Long Quân ở Quận Tây Hồ, Hà Nội | Foody.vn",546 Lạc Long Quân Quận Tây Hồ Hà Nội,06:00,14:00 | 17:00 ,20.000đ ,50.000,['https://images.foody.vn/res/g7/68294/prof/s576x330/foody-mobile-bun3-jpg-133-635936554497377928.jpg'],['6.0'],['6.8'],['6.8'],['6.6'],['6.8'],3,16,7,6,6.6,Bún Bò Huế O Uông - 
4289,4289,6469fb83b1064f9440f711b5,https://www.foody.vn/ha-noi/o-hien-bun-bo-hue,"O Hiền - Bún Bò Huế & Lẩu Đuôi Bò - Tô Hiệu ở Quận Cầu Giấy, Hà Nội | Foody.vn","106 C6 Tô Hiệu, P. Nghĩa Tân Quận Cầu Giấy Hà Nội",06:30,21:30,30.000đ ,55.000,['https://images.foody.vn/res/g3/23872/prof/s576x330/foody-mobile-o-hieu-jpg-866-636275932408191270.jpg'],['6.2'],['6.4'],['6.5'],['6.3'],['6.8'],2,40,40,11,6.5,O Hiền - Bún Bò Huế 
4290,4290,6469fb83b1064f9440f711b6,https://www.foody.vn/ha-noi/nam-an-quan-am-thuc-hue,"Nam An Quán - Ẩm Thực Huế ở Quận Đống Đa, Hà Nội | Foody.vn","56 Nguyên Hồng, P. Láng Hạ Quận Đống Đa Hà Nội",07:00,21:30,25.000đ ,39.000,['https://images.foody.vn/res/g3/23437/prof/s576x330/foody-mobile-buns-jpg-168-635769592803317601.jpg'],['6.6'],['7.3'],['7.4'],['7.0'],['7.5'],2,22,9,3,7.2,Nam An Quán - Ẩm Thự
4291,4291,6469fb83b1064f9440f711b7,https://www.foody.vn/ha-noi/o-xuan-bun-bo-hue-nem-lui,"Bún Bò Huế O Xuân - Tuệ Tĩnh ở Quận Hai Bà Trưng, Hà Nội | Foody.vn","21 - 25 Tuệ Tĩnh, P. Bùi Thị Xuân Quận Hai Bà Trưng Hà Nội",07:00,21:30,35.000đ ,65.000,['https://images.foody.vn/res/g28/278180/prof/s576x330/foody-upload-api-foody-mobile-bun-bo-hue-o-xuan-200512141023.jpg'],['6.5'],['6.8'],['6.9'],['6.6'],['7.2'],1,19,4,6,6.8,Bún Bò Huế O Xuân - 
4292,4292,6469fb83b1064f9440f711b8,https://www.foody.vn/ha-noi/che-cung-dinh-hue-bach-mai,"Chè Cung Đình Huế - Bạch Mai ở Quận Hai Bà Trưng, Hà Nội | Foody.vn",327 Bạch Mai Quận Hai Bà Trưng Hà Nội,10:00,23:00,15.000đ ,28.000,['https://images.foody.vn/res/g5/42049/prof/s576x330/foody-mobile-che2-jpg-500-635938207146380654.jpg'],['6.7'],['6.9'],['7.5'],['6.8'],['7.8'],1,18,3,2,7.1,Chè Cung Đình Huế - 
4294,4294,6469fb83b1064f9440f711ba,https://www.foody.vn/ha-noi/minh-ngoc-bun-bo-gio-heo-banh-loc,"Minh Ngọc - Bún Bò Giò Heo & Bánh Bột Lọc ở Quận Ba Đình, Hà Nội | Foody.vn",110 - 111 A4 TT. Thành Công  Quận Ba Đình Hà Nội,07:30,22:00,20.000đ ,50.000,['https://images.foody.vn/res/g26/250312/prof/s576x330/foody-mobile-13423961_90578880286-675-636027118711856304.jpg'],['6.6'],['7.2'],['7.4'],['7.1'],['7.6'],0,30,9,1,7.2,Minh Ngọc - Bún Bò G
4330,4330,6469fb83b1064f9440f711de,https://www.foody.vn/ha-noi/trinh-bun-bo-hue/binh-luan-17106308,"Trịnh - Bún Bò Huế ở Quận Cầu Giấy, Hà Nội | Bình luận - Trịnh - Bún Bò Huế | Linh | Foody.vn","108 C2 Nghĩa Tân, P. Nghĩa Tân Quận Cầu Giấy Hà Nội",06:00,23:00,30.000đ ,45.000,[],['7.9'],['8.1'],['8.1'],['8.0'],['8.2'],11,7,1,3,8.1,Trịnh - Bún Bò Huế ở
4331,4331,6469fb83b1064f9440f711df,https://www.foody.vn/ha-noi/huyen-anh-2-bun-bo-hue/binh-luan-12362630,"Huyền Anh - Bún Bò Huế - Trương Định ở Quận Hai Bà Trưng, Hà Nội | Bình luận - [Bún bò Huế thập cẩm] Tạm được. | KK Lazi | Foody.vn","24 Trương Định, P. Trương Định Quận Hai Bà Trưng Hà Nội",07:00,22:00,25.000đ ,61.000,['https://images.foody.vn/res/g5/46161/prof/s576x330/file_restaurant_photo_qehk_16100-9c091aa2-210108082445.jpg'],['6.5'],['7.2'],['7.2'],['7.1'],['7.4'],2,12,3,4,7.1,Huyền Anh - Bún Bò H
4333,4333,6469fb83b1064f9440f711e1,https://www.foody.vn/ha-noi/pho-bun-bo-dai-co-viet,"Thu Thùy - Bún Bò Huế ở Quận Hai Bà Trưng, Hà Nội | Foody.vn",18 Đại Cồ Việt Quận Hai Bà Trưng Hà Nội,07:00,15:00,20.000đ ,40.000,['https://images.foody.vn/res/g7/69394/prof/s576x330/foody-mobile-phobo-jpg-219-636148861630545834.jpg'],['6.2'],['7.0'],['7.2'],['6.9'],['7.9'],2,25,4,3,7.1,Thu Thùy - Bún Bò Hu
4337,4337,6469fb83b1064f9440f711e5,https://www.foody.vn/ha-noi/bun-bo-hue-o-ha,"Bún Bò Huế O Hà ở Quận Cầu Giấy, Hà Nội | Foody.vn","84 Võ Chí Công, P. Nghĩa Đô Quận Cầu Giấy Hà Nội",05:00,22:00,30.000đ ,50.000,['https://images.foody.vn/res/g24/232756/prof/s576x330/foody-upload-api-foody-mobile-anh-bia-191111092710.jpg'],['5.8'],['6.4'],['6.8'],['6.1'],['7.4'],2,6,2,4,6.5,Bún Bò Huế O Hà ở Qu
4339,4339,6469fb83b1064f9440f711e7,https://www.foody.vn/ha-noi/bun-tron-ba-hin-s-shop-online,"Bún Trộn Bà Hin's - Shop Online ở Quận Tây Hồ, Hà Nội | Foody.vn","Số 10 ngõ 684 Hoàng Hoa Thám , P. Bưởi Quận Tây Hồ Hà Nội",10:00,14:00 | 16:00 ,35.000đ ,40.000,['https://images.foody.vn/res/g104/1038319/prof/s576x330/foody-upload-api-foody-mobile-c1-200724132434.jpg'],['8.8'],['10.0'],['10.0'],['10.0'],['10.0'],4,0,0,0,9.8,Bún Trộn Bà Hin's - 
4341,4341,6469fb83b1064f9440f711e9,https://www.foody.vn/ha-noi/bun-bo-goc-hue-nguyen-ngoc-vu/binh-luan-12155710,"Bún Bò Gốc Huế - Nguyễn Ngọc Vũ ở Quận Cầu Giấy, Hà Nội | Bình luận - Bún Bò Gốc Huế - Nguyễn Ngọc Vũ | Thảo Nhi | Foody.vn","149 Nguyễn Ngọc Vũ, P. Trung Hòa Quận Cầu Giấy Hà Nội",05:30,22:30,30.000đ ,50.000,['https://images.foody.vn/res/g66/658139/prof/s576x330/foody-mobile-354-jpg-639-636300055817980888.jpg'],['8.5'],['8.7'],['9.0'],['8.6'],['9.0'],24,14,2,1,8.8,Bún Bò Gốc Huế - Ngu
4342,4342,6469fb83b1064f9440f711ea,https://www.foody.vn/ha-noi/bun-bo-hue-47-nga-tu-so/binh-luan-11756625,"Bún Bò Huế 47 - Ngã Tư Sở ở Quận Đống Đa, Hà Nội | Bình luận - ăn tạm được, không quá ngon | Sang Vu | Foody.vn",59 Đường Láng Quận Đống Đa Hà Nội,07:00,23:30,30.000đ ,50.000,['https://images.foody.vn/res/g9/83370/prof/s576x330/foody-mobile-bun-jpg-490-635786189719214287.jpg'],['6.0'],['6.9'],['7.0'],['6.8'],['7.0'],2,10,10,3,6.7,Bún Bò Huế 47 - Ngã 
4395,4395,6469fb83b1064f9440f7121f,https://www.foody.vn/ha-noi/bun-cha-binh-chung/binh-luan-12826870,"Bún Chả Que Tre Bình Chung - Bạch Mai ở Quận Hai Bà Trưng, Hà Nội | Bình luận - Bún Chả Que Tre Bình Chung - Bạch Mai | quanly73 | Foody.vn","299 Bạch Mai, P. Bạch Mai Quận Hai Bà Trưng Hà Nội",10:00,15:00,40.000đ ,66.000,[],['6.3'],['6.7'],['6.7'],['6.5'],['6.9'],2,27,10,6,6.6,Bún Chả Que Tre Bình
4396,4396,6469fb83b1064f9440f71220,https://www.foody.vn/ha-noi/y-coffee-ly-thuong-kiet/binh-luan-17095863,"Y Coffee - Lý Thường Kiệt ở Quận Hoàn Kiếm, Hà Nội | Bình luận - Trải nghiệm tồi tệ | Linh | Foody.vn",2 Lý Thường Kiệt Quận Hoàn Kiếm Hà Nội,07:00,23:00,15.000đ ,200.000,['https://images.foody.vn/res/g12/111145/prof/s576x330/foody-mobile-dfeu8jr4-jpg-488-635781880326730708.jpg'],['6.4'],['7.0'],['7.4'],['6.7'],['7.9'],2,18,6,3,7.1,Y Coffee - Lý Thường
4397,4397,6469fb83b1064f9440f71221,https://www.foody.vn/ha-noi/vit-/binh-luan-2898570,"Vịt + ở Quận Đống Đa, Hà Nội | Bình luận - Vịt ngon | Võ Phú An | Foody.vn","5 Ngõ Quan Thổ 1, P. Ô Chợ Dừa Quận Đống Đa Hà Nội",16:00,23:59,30.000đ ,200.000,['https://images.foody.vn/res/g65/643035/prof/s576x330/foody-mobile-foody-vit-643035-701-902-636250151273701545.jpg'],['6.8'],['7.2'],['7.3'],['7.0'],['7.8'],3,4,0,2,7.2,Vịt + ở Quận Đống Đa
4400,4400,6469fb83b1064f9440f71224,https://www.foody.vn/ha-noi/bun-cha-pho-co-ngoc-dung/binh-luan-8556588,"Bún Chả Phố Cổ Ngọc Dung ở Quận Hai Bà Trưng, Hà Nội | Bình luận - Ăn bình thường | Huyền | Foody.vn","Ki Ốt 6, Nhà 8, Ngõ Tự Do, P. Đồng Tâm Quận Hai Bà Trưng Hà Nội",07:00,22:00,15.000đ ,25.000,['https://images.foody.vn/res/g21/206658/prof/s576x330/foody-mobile-buncha-jpg-826-636222492785316714.jpg'],['7.1'],['8.4'],['8.6'],['7.7'],['9.0'],9,16,4,0,8.1,Bún Chả Phố Cổ Ngọc 
4440,4440,6469fb83b1064f9440f7124c,https://www.foody.vn/ha-noi/bumtro-bun-tron-nam-bo-chien-thang/binh-luan-15821117,"BUMTRO - Bún Trộn Nam Bộ - Chiến Thắng ở Quận Hà Đông, Hà Nội | Bình luận - Bún Trộn mê đắm bao lòng người | Dương Ngọc Ánh | Foody.vn","262 Chiến Thắng, P. Văn Quán Quận Hà Đông Hà Nội",08:00,22:00,25.000đ ,60.000,['https://images.foody.vn/res/g98/970725/prof/s576x330/foody-upload-api-foody-mobile-2-200917114015.jpg'],['8.0'],['8.6'],['8.6'],['8.4'],['8.8'],3,1,1,0,8.5,BUMTRO - Bún Trộn Na
4441,4441,6469fb83b1064f9440f7124d,https://www.foody.vn/ha-noi/hieu-vit-nam-ngu/binh-luan-2132905,"Hiếu Vịt - Nam Ngư ở Quận Hoàn Kiếm, Hà Nội | Bình luận - Hiếu Vịt - Nam Ngư | Anh Nguyen | Foody.vn","44 Nam Ngư, P. Cửa Nam Quận Hoàn Kiếm Hà Nội",09:00,22:45,50.000đ ,250.000,[],['6.1'],['6.8'],['6.8'],['6.6'],['6.9'],0,5,5,1,6.6,Hiếu Vịt - Nam Ngư ở
4443,4443,6469fb83b1064f9440f7124f,https://www.foody.vn/ha-noi/gimbap-shochu/binh-luan-1167362,"Nhà hàng Gimbap Shochu - Ẩm thực Hàn Quốc ở Quận Cầu Giấy, Hà Nội | Bình luận - Bình thường thôi | Bich Nguyen | Foody.vn",39 Trần Đăng Ninh Quận Cầu Giấy Hà Nội,10:00,21:00,80.000đ ,132.000,['https://images.foody.vn/res/g1/8620/prof/s576x330/foody-mobile-gimbap-shochu-ha-noi.jpg'],['5.7'],['6.5'],['6.7'],['6.1'],['6.8'],0,15,13,6,6.3,Nhà hàng Gimbap Shoc
4444,4444,6469fb83b1064f9440f71250,https://www.foody.vn/ha-noi/trieu-nhat-asahi-sushi-ba-trieu/binh-luan-11323896,"Triều Nhật Asahi Sushi - Bà Triệu ở Quận Hai Bà Trưng, Hà Nội | Bình luận - Lần sau không bao giờ quay lại | Phạm Xuân | Foody.vn",288 Bà Triệu Quận Hai Bà Trưng Hà Nội,10:00,23:00,200.000đ ,440.000,['https://images.foody.vn/res/g1/6044/prof/s576x330/foody-mobile-tn-jpg-966-635766300631879207.jpg'],['5.7'],['7.7'],['7.9'],['7.3'],['8.0'],5,19,4,2,7.3,Triều Nhật Asahi Sus
4459,4459,6469fb83b1064f9440f7125f,https://www.foody.vn/ha-noi/foodie-do-an-han-viet-au-co/binh-luan-9133711,"Foodie - Đồ Ăn Hàn & Việt - Âu Cơ ở Quận Tây Hồ, Hà Nội | Bình luận - Đã đến nhiều lần... | Thị Hồng Vũ | Foody.vn",399/37/18 Âu Cơ Quận Tây Hồ Hà Nội,11:00,22:30,20.000đ ,70.000,['https://images.foody.vn/res/g75/749681/prof/s576x330/foody-upload-api-foody-mobile-foodie-jpg-180612093137.jpg'],['5.0'],['5.0'],['6.0'],['5.0'],['6.3'],1,2,1,2,5.5,Foodie - Đồ Ăn Hàn &
4488,4488,6469fb83b1064f9440f7127c,https://www.foody.vn/ha-noi/lotteria-cau-giay/binh-luan-16571308,"Lotteria Cầu Giấy: Hamburger, Gà Rán, Cơm Kẹp ở Quận Cầu Giấy, Hà Nội | Bình luận - Lotteria - Cầu Giấy | tanh7942 | Foody.vn","298 Cầu Giấy, P. Quan Hoa Quận Cầu Giấy Hà Nội",07:30,22:30,30.000đ ,77.000,[],['6.5'],['6.9'],['7.2'],['6.8'],['7.7'],2,74,20,9,7.0,Lotteria Cầu Giấy: H
4491,4491,6469fb83b1064f9440f7127f,https://www.foody.vn/ha-noi/ga-36-linh-dam/binh-luan-4135647,"Gà 36 - Linh Đàm ở Quận Hoàng Mai, Hà Nội | Bình luận - Thái độ nhân viên không tôn trọng khách hàng | Thanh | Foody.vn","36 Nguyễn Hữu Thọ (đường đôi Linh Đàm), P. Hoàng Liệt Quận Hoàng Mai Hà Nội",10:30,14:00 | 16:00 ,70.000đ ,165.000,['https://images.foody.vn/res/g1/52/prof/s576x330/foody-upload-api-foody-mobile-ga-36-jpg-181218163309.jpg'],['4.9'],['5.8'],['5.8'],['5.5'],['5.9'],0,4,5,4,5.5,Gà 36 - Linh Đàm ở Q
4523,4523,6469fb83b1064f9440f7129f,https://www.foody.vn/ha-noi/ga-36-ha-dong/binh-luan-17020863,"Gà 36 - Hà Đông ở Quận Hà Đông, Hà Nội | Bình luận - Gà 36 - Hà Đông | Giang | Foody.vn",18 Ngõ 23 Nguyễn Văn Lộc (18 Dãy 16A4 Làng Việt Kiều Châu Âu) Quận Hà Đông Hà Nội,08:00,23:00,50.000đ ,220.000,['https://images.foody.vn/res/g1/5456/prof/s576x330/foody-upload-api-foody-mobile-ga-36-jpg-181218163828.jpg'],['5.6'],['6.3'],['6.4'],['6.1'],['6.7'],0,11,6,5,6.2,Gà 36 - Hà Đông ở Qu
4525,4525,6469fb83b1064f9440f712a1,https://www.foody.vn/ha-noi/sinsa-korea-kitchen-mon-an-han-quoc/binh-luan-3965923,"SINSA Korea Kitchen ở Quận Ba Đình, Hà Nội | Bình luận - SINSA Korea Kitchen | Quỳnhchi Nguyễn | Foody.vn","80 Trấn Vũ, P. Quán Thánh Quận Ba Đình Hà Nội",10:00,21:00,20.000đ ,40.000,['https://images.foody.vn/res/g81/800762/prof/s576x330/foody-upload-api-foody-mobile-foody-cover-15-191213091441.jpg'],['8.0'],['8.7'],['9.1'],['8.5'],['9.1'],14,14,1,0,8.7,SINSA Korea Kitchen 
4527,4527,6469fb83b1064f9440f712a3,https://www.foody.vn/ha-noi/korea-box-1998-am-thuc-han-quoc/binh-luan-2515522,"Korea Box 1998 - Ẩm Thực Hàn Quốc ở Quận Tây Hồ, Hà Nội | Bình luận - So ngonn..... | Thục Anh Lê | Foody.vn","51 Xuân Diệu, P. Quảng An Quận Tây Hồ Hà Nội",10:00,23:00,20.000đ ,100.000,['https://images.foody.vn/res/g75/745478/prof/s576x330/foody-upload-api-foody-mobile-korea-jpg-180529132934.jpg'],['7.0'],['7.5'],['7.7'],['7.3'],['7.8'],2,7,1,1,7.5,Korea Box 1998 - Ẩm 
4528,4528,6469fb83b1064f9440f712a4,https://www.foody.vn/ha-noi/mi-tay-to/binh-luan-12835644,"Mì Tay To - KĐT Nam Trung Yên ở Quận Cầu Giấy, Hà Nội | Bình luận - Ngon | Ruby N. | Foody.vn","8 Lô A10 KĐT Nam Trung Yên, P. Yên Hòa Quận Cầu Giấy Hà Nội",09:00,22:00,50.000đ ,50.000,['https://images.foody.vn/res/g89/887481/prof/s576x330/foody-upload-api-foody-mobile-avar-190527090605.jpg'],['6.9'],['7.2'],['7.4'],['7.1'],['7.6'],3,9,1,3,7.3,Mì Tay To - KĐT Nam 
4530,4530,6469fb83b1064f9440f712a6,https://www.foody.vn/ha-noi/yeol-kwang-am-thuc-han-quoc/binh-luan-15929471,"Yeol Kwang - Ẩm Thực Hàn Quốc ở Quận Cầu Giấy, Hà Nội | Bình luận - Canh kim chi có gián | Minh Thuý | Foody.vn","72 Trương Công Giai, P. Dịch Vọng Quận Cầu Giấy Hà Nội",11:30,20:30,160.000đ ,580.000,[],['6.9'],['7.3'],['7.4'],['7.1'],['7.5'],3,33,3,5,7.2,Yeol Kwang - Ẩm Thực
4568,4568,6469fb83b1064f9440f712cc,https://www.foody.vn/ha-noi/korean-kitchen-bep-han-online/binh-luan-8834265,"Korean Kitchen - Bếp Hàn Online - Lương Định Của ở Quận Đống Đa, Hà Nội | Bình luận - Korean Kitchen - Bếp Hàn Online - Đặng Văn Ngữ | Hằng Thu | Food","102 Ngõ 4C Đặng Văn Ngữ, P. Trưng Tự Quận Đống Đa Hà Nội",10:30,21:00,25.000đ ,100.000,['https://images.foody.vn/res/g86/854742/prof/s576x330/image-5a4c5a9c-200910115812.jpeg'],['7.4'],['7.9'],['7.9'],['7.8'],['8.3'],43,30,15,10,7.9,Korean Kitchen - Bếp
